source,app_name,content,score,at,clean_content,label_sentimen
Quora,E-Wallet Discussion,"Here’s the thing: I wish I had known these money secrets sooner. They’ve helped so many people save hundreds, secure their family’s future, and grow their bank accounts—myself included. And honestly? Putting them to use was way easier than I had expected. I bet you can knock out at least three or four of these right now—yes, even from your phone. Don’t wait like I did. 1. Cancel Your Car Insurance You might not even realize it, but your car insurance company is probably overcharging you. In fact, they’re kind of counting on you not noticing. Luckily, this problem is easy to fix. Don’t waste your time browsing insurance sites for a better deal. A company called Insurify shows you all your options at once — people who do this save up to $996 per year. If you tell them a bit about yourself and your vehicle, they’ll send you personalized quotes so you can compare them and find the best one for you. Tired of overpaying for car insurance? It takes just five minutes to compare your options with Insurify and see how much you could save on car insurance. 2. Set Up Direct Deposit — Pocket $400 When you set up direct deposit with SoFi Checking and Savings (Member FDIC), they’ll put up to $400 straight into your account. No… really. Just a nice little bonus for making a smart switch. Why switch? With SoFi, you can earn up to 3.80% APY on savings and 0.50% on checking, plus a 0.20% APY boost for your first 6 months when you set up direct deposit or keep $5K in your account. That’s up to 4.00% APY total. Way better than letting your balance chill at 0.40% APY. There’s no fees. No gotchas. Make the move to SoFi and get paid to upgrade your finances. 3. You Can Start Investing in Real Estate for Just $10 You don’t need to be a millionaire or know how to be a landlord to invest in real estate. With the Fundrise Flagship Fund, you can start with just $10 and let your money do the work for you. So where does your $10 go? The Flagship Fund pools money from everyday investors and uses it to buy and manage real estate, things like apartment buildings or housing developments. As these properties earn money, you could receive quarterly dividends or watch your investment grow over time. You don’t have to deal with tenants, repairs, or any of the hard stuff. The Flagship Fund takes care of it all, and you can track your progress anytime right from your phone. It only takes a few minutes to get started.* You can join the Fundrise Flagship Fund today and start building wealth with just $10. 4. Ask This Company to Get a Big Chunk of Debt Forgiven A company named National Debt Relief has the capability to negotiate with lenders to reduce a portion of existing debt. This process does not require bankruptcy or loans, and credit history is not a determining factor. For those with at least $10,000 in unsecured debt, such as credit card bills, personal loans, or medical expenses, experts at National Debt Relief can develop a monthly payment plan. As payments accumulate, negotiations with creditors may lead to a reduction in the total debt owed, which can then be settled in a lump sum. On average, individuals might achieve debt freedom within 24 to 48 months. The sign-up process takes less than a minute to assess potential debt reduction options. 5. Get Paid $225/Month While Watching Movie Previews If we told you that you could get paid while watching videos on your computer, you’d probably laugh. It’s too good to be true, right? But we’re serious. By signing up for a free account with InboxDollars, you could add up to $225 a month to your pocket. They’ll send you short surveys every day, which you can fill out while you watch someone bake brownies or catch up on the latest Kardashian drama. No, InboxDollars won’t replace your full-time job, but it’s something easy you can do while you’re already on the couch tonight, wasting time on your phone. Unlike other sites, InboxDollars pays you in cash — no points or gift cards. It’s already paid its users more than $56 million. Signing up takes about one minute, and you’ll immediately receive a $5 bonus to get you started. This is a paid advertisement. Carefully consider the investment objectives, risks, charges and expenses of the Fundrise Real Estate Fund before investing. This and other information can be found in the Fund’s prospectus. Read them carefully before investing.",,,heres the thing i wish i had known these money secrets sooner theyve helped so many people save hundreds secure their familys future and grow their bank accountsmyself included and honestly putting them to use was way easier than i had expected i bet you can knock out at least three or four of these right nowyes even from your phone dont wait like i did  cancel your car insurance you might not even realize it but your car insurance company is probably overcharging you in fact theyre kind of counting on you not noticing luckily this problem is easy to fix dont waste your time browsing insurance sites for a better deal a company called insurify shows you all your options at once  people who do this save up to  per year if you tell them a bit about yourself and your vehicle theyll send you personalized quotes so you can compare them and find the best one for you tired of overpaying for car insurance it takes just five minutes to compare your options with insurify and see how much you could save on car insurance  set up direct deposit  pocket  when you set up direct deposit with sofi checking and savings member fdic theyll put up to  straight into your account no really just a nice little bonus for making a smart switch why switch with sofi you can earn up to  apy on savings and  on checking plus a  apy boost for your first  months when you set up direct deposit or keep k in your account thats up to  apy total way better than letting your balance chill at  apy theres no fees no gotchas make the move to sofi and get paid to upgrade your finances  you can start investing in real estate for just  you dont need to be a millionaire or know how to be a landlord to invest in real estate with the fundrise flagship fund you can start with just  and let your money do the work for you so where does your  go the flagship fund pools money from everyday investors and uses it to buy and manage real estate things like apartment buildings or housing developments as these properties earn money you could receive quarterly dividends or watch your investment grow over time you dont have to deal with tenants repairs or any of the hard stuff the flagship fund takes care of it all and you can track your progress anytime right from your phone it only takes a few minutes to get started you can join the fundrise flagship fund today and start building wealth with just   ask this company to get a big chunk of debt forgiven a company named national debt relief has the capability to negotiate with lenders to reduce a portion of existing debt this process does not require bankruptcy or loans and credit history is not a determining factor for those with at least  in unsecured debt such as credit card bills personal loans or medical expenses experts at national debt relief can develop a monthly payment plan as payments accumulate negotiations with creditors may lead to a reduction in the total debt owed which can then be settled in a lump sum on average individuals might achieve debt freedom within  to  months the signup process takes less than a minute to assess potential debt reduction options  get paid month while watching movie previews if we told you that you could get paid while watching videos on your computer youd probably laugh its too good to be true right but were serious by signing up for a free account with inboxdollars you could add up to  a month to your pocket theyll send you short surveys every day which you can fill out while you watch someone bake brownies or catch up on the latest kardashian drama no inboxdollars wont replace your fulltime job but its something easy you can do while youre already on the couch tonight wasting time on your phone unlike other sites inboxdollars pays you in cash  no points or gift cards its already paid its users more than  million signing up takes about one minute and youll immediately receive a  bonus to get you started this is a paid advertisement carefully consider the investment objectives risks charges and expenses of the fundrise real estate fund before investing this and other information can be found in the funds prospectus read them carefully before investing,
PlayStore,ShopeePay,"kasih keterangan dong kalau toko sedang tutup, atau jangan tampil di beranda dulu selama gak beroperasi biar gak ada salah paham. secara ini kan berbelanja via online masa harus tahu jadwal buka toko.",5.0,2026-05-09 19:56:44,kasih keterangan dong kalau toko sedang tutup atau jangan tampil di beranda dulu selama gak beroperasi biar gak ada salah paham secara ini kan berbelanja via online masa harus tahu jadwal buka toko,
Quora,E-Wallet Discussion,"Social distancing has become a new norm in today’s grim situation. The COVID-19 pandemic has affected all the markets and industry sectors along with daily life globally. However, in this digital world, the flow of money cannot stop by the coronavirus outbreak or lockdowns. As a result, the adoption…",,,social distancing has become a new norm in todays grim situation the covid pandemic has affected all the markets and industry sectors along with daily life globally however in this digital world the flow of money cannot stop by the coronavirus outbreak or lockdowns as a result the adoption,
Quora,E-Wallet Discussion,"A decentralized wallet means that the holder of the keys will be accorded access to the crypto wallet. It allows the holder to use the keys to send or receive cryptocurrency anywhere on the planet. Some people regard a decentralized wallet to be anonymous, but it is not. It is Pseudonymous.",,,a decentralized wallet means that the holder of the keys will be accorded access to the crypto wallet it allows the holder to use the keys to send or receive cryptocurrency anywhere on the planet some people regard a decentralized wallet to be anonymous but it is not it is pseudonymous,
PlayStore,GoPay,mantappppp,5.0,2026-04-14 15:17:14,mantappppp,
PlayStore,DANA,terimakasih sangat membantu buat saya..,4.0,2026-05-06 17:06:57,terimakasih sangat membantu buat saya,
PlayStore,ShopeePay,"ini aplikasi membantu banget, aku mau beli barang jadi nggak ribet bagus juga, aman banget, aplikasinya udah terpercaya THANKYOU 👍🏻",5.0,2026-05-09 18:34:29,ini aplikasi membantu banget aku mau beli barang jadi nggak ribet bagus juga aman banget aplikasinya udah terpercaya thankyou,
PlayStore,ShopeePay,barang bagus,5.0,2026-05-09 16:38:34,barang bagus,
PlayStore,DANA,"niat hati ingin berinvestasi di di dana plus,masa saya top up saldo sudah masuk 2 hari kemudian di lihat saldo aktif 0 rupiah ga bener",1.0,2026-05-06 04:53:47,niat hati ingin berinvestasi di di dana plusmasa saya top up saldo sudah masuk  hari kemudian di lihat saldo aktif  rupiah ga bener,
PlayStore,GoPay,"tolong lah gojek bikin 2 gocar biasa orng Ama bareng terkadang orng pesen ny SE enak nya pesen biasa yg naik 5 orng pesen biasa yang naik bareng sama orng , terkadang orng pada zolim gojek tolong di pertimbangkan",2.0,2026-04-25 21:39:54,tolong lah gojek bikin  gocar biasa orng ama bareng terkadang orng pesen ny se enak nya pesen biasa yg naik  orng pesen biasa yang naik bareng sama orng  terkadang orng pada zolim gojek tolong di pertimbangkan,
PlayStore,GoPay,"iklan sama realitanya kenapa berbeda ya? katanya gojek plus bikin makin murah dan hemat, tapi nyatanya tetap sama aja tuh gak ada perubahan signifikan untuk harganya, mana banyak banget lagi ketentuan yang harus dipenuhi sebelum pake promonya 🤦🏻‍♀️ kapok deh langganan gojek plus nya",2.0,2026-04-13 22:46:49,iklan sama realitanya kenapa berbeda ya katanya gojek plus bikin makin murah dan hemat tapi nyatanya tetap sama aja tuh gak ada perubahan signifikan untuk harganya mana banyak banget lagi ketentuan yang harus dipenuhi sebelum pake promonya  kapok deh langganan gojek plus nya,
PlayStore,ShopeePay,"estimasi tiba tanggal 7, sampai tanggal 8 belum sampai sampai wkwk",3.0,2026-05-08 17:13:51,estimasi tiba tanggal  sampai tanggal  belum sampai sampai wkwk,
PlayStore,ShopeePay,aplikasi ini sangat berguna,5.0,2026-05-06 16:08:20,aplikasi ini sangat berguna,
PlayStore,ShopeePay,belanja mudah juga murah..,5.0,2026-05-06 14:23:17,belanja mudah juga murah,
Quora,E-Wallet Discussion,"Studied at Veer Surendra Sai University of Technology, Burla",,,studied at veer surendra sai university of technology burla,
PlayStore,ShopeePay,"saya menjual barang, barang udh sampe ke pembeli tapi di apk masih proses pengiriman sampe 14 hari, skrg mlh dibatalin pihak shopee, terus gimana barang saya?, dan dana saya ga cair?,.",1.0,2026-05-05 00:19:15,saya menjual barang barang udh sampe ke pembeli tapi di apk masih proses pengiriman sampe  hari skrg mlh dibatalin pihak shopee terus gimana barang saya dan dana saya ga cair,
PlayStore,GoPay,pelayanan nya ok.,5.0,2026-04-13 11:51:03,pelayanan nya ok,
PlayStore,DANA,"min ini kenapa dana sekarang aplikasi nya gak kek dulu ya, kalo ada tf masuk uang nya sekarang gak langsung masuk.. masuknya lama bgt sekarang gak kek dulu.",4.0,2026-05-04 21:09:25,min ini kenapa dana sekarang aplikasi nya gak kek dulu ya kalo ada tf masuk uang nya sekarang gak langsung masuk masuknya lama bgt sekarang gak kek dulu,
PlayStore,ShopeePay,aplikasinya bagus buat belanja online,5.0,2026-05-06 22:23:27,aplikasinya bagus buat belanja online,
PlayStore,GoPay,"ongkir food jadi mahal banget tanpa ada promo2 lg, mending offline atau masak sendiri, usaha resto omzetnya berkurang drastis padahal harga tidak dinaikan",5.0,2026-04-18 20:13:44,ongkir food jadi mahal banget tanpa ada promo lg mending offline atau masak sendiri usaha resto omzetnya berkurang drastis padahal harga tidak dinaikan,
PlayStore,GoPay,aku sangat membutuhkan aplikasi pesanan makanan secara online,5.0,2026-04-08 19:11:23,aku sangat membutuhkan aplikasi pesanan makanan secara online,
PlayStore,DANA,slalu ok,5.0,2026-05-09 11:22:44,slalu ok,
PlayStore,ShopeePay,"banyak barang palsunya, banyak yang tidak sesuai, shoope tidak peduli kelakuan pelapak, juga tidak peduli dengan keresahan pembeli",1.0,2026-05-10 12:16:12,banyak barang palsunya banyak yang tidak sesuai shoope tidak peduli kelakuan pelapak juga tidak peduli dengan keresahan pembeli,
PlayStore,GoPay,gojek keren,5.0,2026-04-20 20:44:25,gojek keren,
PlayStore,DANA,gakbisa Qiris lol,1.0,2026-05-06 01:53:56,gakbisa qiris lol,
Quora,E-Wallet Discussion,"Investment Advisor/ Entrepreneur/Crypto head, tourist",,,investment advisor entrepreneurcrypto head tourist,
PlayStore,ShopeePay,Aplikasi belanja yang bagus,5.0,2026-05-05 13:36:24,aplikasi belanja yang bagus,
PlayStore,ShopeePay,kecewa banget sama shopee pay nya .pin lupa no hp udah gak aktif..susah banget mau pake saldo di shopee pay gak ada keringanan sama sekali,1.0,2026-05-04 22:26:45,kecewa banget sama shopee pay nya pin lupa no hp udah gak aktifsusah banget mau pake saldo di shopee pay gak ada keringanan sama sekali,
PlayStore,ShopeePay,"bunga cicilan spaylater gede belum biaya penanganan turunkan bunga spaylater cicilan 3-6 bulan,dpt potongan discon kecil dan koin kecil",1.0,2026-05-07 23:58:52,bunga cicilan spaylater gede belum biaya penanganan turunkan bunga spaylater cicilan  bulandpt potongan discon kecil dan koin kecil,
PlayStore,ShopeePay,"ada apa dengan kamu shopee?????? ekspedisimu SANGAT LAMBAT Skrang, dulu paling lama 4 hari sampe. Skrang 10 hari aja belum tentu sampe. bnyak bgt paket ku yg stuck dari bulan puasa, ku kira karna mau lebaran aja waktu itu. nyatanya sampe bulan mei masih gitu aja penanganannya, sekarang kalau mau pesen di shopee was was bgt kalo pas lgi urgent. bahkan ada paket yg di tunggu 2 bulan gak sampe dan dinyatakan hilang oleh shopee. PERBAIKI!!!! SEBELUM BNYAK YG KECEWA.",2.0,2026-05-07 19:14:02,ada apa dengan kamu shopee ekspedisimu sangat lambat skrang dulu paling lama  hari sampe skrang  hari aja belum tentu sampe bnyak bgt paket ku yg stuck dari bulan puasa ku kira karna mau lebaran aja waktu itu nyatanya sampe bulan mei masih gitu aja penanganannya sekarang kalau mau pesen di shopee was was bgt kalo pas lgi urgent bahkan ada paket yg di tunggu  bulan gak sampe dan dinyatakan hilang oleh shopee perbaiki sebelum bnyak yg kecewa,
PlayStore,ShopeePay,"aplikasi online shop kebanggaan, dari dulu pake shoope kalau mau belanja online. cuman ya mon maap banget nih, suka sok asik bat muncul dimanapun dan kapanpun iklannnya. apalagi pas gw mau baca komik, novel atau buka web, gua ga nyentuh banner iklannya samsek padahal tapi langsung pindah alam 😭💔 sialan emg.",5.0,2026-05-05 21:44:44,aplikasi online shop kebanggaan dari dulu pake shoope kalau mau belanja online cuman ya mon maap banget nih suka sok asik bat muncul dimanapun dan kapanpun iklannnya apalagi pas gw mau baca komik novel atau buka web gua ga nyentuh banner iklannya samsek padahal tapi langsung pindah alam  sialan emg,
Quora,E-Wallet Discussion,"Yes, it’s absolutely possible to find out who your boyfriend or girlfriend is messaging — but the smartest way to do it is to quietly gather information without them knowing. Here’s how you can figure it out without creating a huge fight: Start with a Reverse Phone Lookup 👉 SEE WHO THEY’RE TEXTING HERE If you’ve noticed any suspicious numbers in their phone or if they’ve been texting someone a lot, you can enter the number here. It will show you who owns the number, their name, location, and even connected social profiles. This is the fastest way to see who they’re talking to without making them suspicious. Pay Attention to Their Behavior Sometimes the biggest clues are right in front of you. If they’re suddenly super protective of their phone, taking calls in private, or quickly turning the screen away when you’re nearby, those are all warning signs. But don’t jump to conclusions without proof. Check for Hidden Social Media Profiles If you suspect they’re messaging someone they met online, you can also see if they have secret social profiles. 👉 FIND HIDDEN SOCIAL PROFILES. Just enter their name, email, or phone number, and you can see if they’re connected to secret Instagram, Facebook, or Snapchat accounts. Look for Secret Dating Profiles If they’re messaging someone they met online, they might also have hidden dating profiles. 👉 UNCOVER DATING PROFILES. This tool can show you if they’re active on Tinder, Bumble, Hinge, or other apps. Make a List of Suspicious Numbers If you have brief access to their phone, take note of any numbers that don’t have names saved or that show up a lot. These are the ones you’ll want to look up. Gather Proof Before You Confront Them It’s important not to accuse them without solid evidence. People who are cheating or hiding something will deny it if you have nothing to back up your suspicions. This is why it’s better to gather your facts quietly first. And Yes, These Tools Aren’t Free — But They’re Worth It I know you might be tempted to use a free tool, but most of those are useless and give you almost nothing. These tools aren’t free, but they’re cheap, and they actually work. 👉 SEE WHO THEY’RE TEXTING HERE.",,,yes its absolutely possible to find out who your boyfriend or girlfriend is messaging  but the smartest way to do it is to quietly gather information without them knowing heres how you can figure it out without creating a huge fight start with a reverse phone lookup  see who theyre texting here if youve noticed any suspicious numbers in their phone or if theyve been texting someone a lot you can enter the number here it will show you who owns the number their name location and even connected social profiles this is the fastest way to see who theyre talking to without making them suspicious pay attention to their behavior sometimes the biggest clues are right in front of you if theyre suddenly super protective of their phone taking calls in private or quickly turning the screen away when youre nearby those are all warning signs but dont jump to conclusions without proof check for hidden social media profiles if you suspect theyre messaging someone they met online you can also see if they have secret social profiles  find hidden social profiles just enter their name email or phone number and you can see if theyre connected to secret instagram facebook or snapchat accounts look for secret dating profiles if theyre messaging someone they met online they might also have hidden dating profiles  uncover dating profiles this tool can show you if theyre active on tinder bumble hinge or other apps make a list of suspicious numbers if you have brief access to their phone take note of any numbers that dont have names saved or that show up a lot these are the ones youll want to look up gather proof before you confront them its important not to accuse them without solid evidence people who are cheating or hiding something will deny it if you have nothing to back up your suspicions this is why its better to gather your facts quietly first and yes these tools arent free  but theyre worth it i know you might be tempted to use a free tool but most of those are useless and give you almost nothing these tools arent free but theyre cheap and they actually work  see who theyre texting here,
PlayStore,ShopeePay,2 kali beli barang lwat apps ini lebih dari 4 bulan ternyata uang ilang barang tak kujung dtang dan ikelan di apps lain bikin kesel ndak bisa disekip dan tanpa durasi,1.0,2026-05-09 23:50:16,kali beli barang lwat apps ini lebih dari  bulan ternyata uang ilang barang tak kujung dtang dan ikelan di apps lain bikin kesel ndak bisa disekip dan tanpa durasi,
PlayStore,GoPay,cuma gopay later ya ga bisa di pakai,5.0,2026-04-16 19:15:12,cuma gopay later ya ga bisa di pakai,
Quora,E-Wallet Discussion,"Investment Advisor/ Entrepreneur/Crypto head, touristAuthor has 1.6K answers and 723.4K answer views",,,investment advisor entrepreneurcrypto head touristauthor has k answers and k answer views,
PlayStore,ShopeePay,Soal voucher Shopee enak banget banyak voucher dan gratis ongkir. Tapi aplikasinya agak lambat jadi berat harus sinyal kencang banget.,4.0,2026-05-09 12:26:04,soal voucher shopee enak banget banyak voucher dan gratis ongkir tapi aplikasinya agak lambat jadi berat harus sinyal kencang banget,
Quora,E-Wallet Discussion,"So, after all these things - you can decide which method is more secure and which one is less secure and there are wallets available in all those categories. Now, you choose your wallet by keeping the discussed points in your mind.",,,so after all these things  you can decide which method is more secure and which one is less secure and there are wallets available in all those categories now you choose your wallet by keeping the discussed points in your mind,
PlayStore,GoPay,enak untuk menjelajahi semua tempat,5.0,2026-04-22 14:57:44,enak untuk menjelajahi semua tempat,
PlayStore,DANA,"Ngapo si pihak dana mempersulit verifikasi.mau pindahin saldo akun lama ke akun baru ribet apa si gunanya KTP sama wajah yg imut ini kalo mau pindahin saldo sendiri susah,karna akun lama kartu ilang HP rusak jadi dak bisa verifikasi melalui WA kan ada email ada KTP jadi itu semua untuk apa???kami ini sebagai pemakai akun berhak atas uang kami walaupun uangnya tidak seberapa tapi bagi kami itu sangat berharga, tolong pihak dana tolong mempermudah lagi proses² yg berbelit² ini🙏🙏",1.0,2026-05-09 16:58:02,ngapo si pihak dana mempersulit verifikasimau pindahin saldo akun lama ke akun baru ribet apa si gunanya ktp sama wajah yg imut ini kalo mau pindahin saldo sendiri susahkarna akun lama kartu ilang hp rusak jadi dak bisa verifikasi melalui wa kan ada email ada ktp jadi itu semua untuk apakami ini sebagai pemakai akun berhak atas uang kami walaupun uangnya tidak seberapa tapi bagi kami itu sangat berharga tolong pihak dana tolong mempermudah lagi proses yg berbelit ini,
PlayStore,GoPay,Ok baik,5.0,2026-04-15 21:19:24,ok baik,
PlayStore,DANA,"mhon maaf kapan ya dana cicil saya muncul,saya udh sering isi saldo 2jta tapi tidak dalat dana cicil an nya🙏🙏🙏",5.0,2026-05-10 02:07:44,mhon maaf kapan ya dana cicil saya munculsaya udh sering isi saldo jta tapi tidak dalat dana cicil an nya,
PlayStore,DANA,apk jelek tidak aman saldo 19.000.000 raib.,1.0,2026-05-06 15:43:47,apk jelek tidak aman saldo  raib,
PlayStore,ShopeePay,selama saya menggunakan shopee segalanya JD mudah dan gampang barang yg sy cari selalu ada dan juga murah banyak ragamnya juga .selama ini shopee selalu menjaga agar konsumen tidak ragu atau bimbang terhadap pelayanan pembelian produk yg diberikan kepada konsumen.serta selalu menjamin kenyamanan bertransaksi.mantap pokoknya . trima kasih shopee,5.0,2026-05-09 13:17:16,selama saya menggunakan shopee segalanya jd mudah dan gampang barang yg sy cari selalu ada dan juga murah banyak ragamnya juga selama ini shopee selalu menjaga agar konsumen tidak ragu atau bimbang terhadap pelayanan pembelian produk yg diberikan kepada konsumenserta selalu menjamin kenyamanan bertransaksimantap pokoknya  trima kasih shopee,
PlayStore,ShopeePay,"sangat simpel dan membantu bagi penggunanya. Sayang sering trobel terlalu banyak iklan yg gak begitu penting buang saja fitur2 recehan, yg tidak penting, agar tidak sering error...",5.0,2026-05-06 16:53:37,sangat simpel dan membantu bagi penggunanya sayang sering trobel terlalu banyak iklan yg gak begitu penting buang saja fitur recehan yg tidak penting agar tidak sering error,
