source,app_name,content,score,at,clean_content,label_sentimen
PlayStore,ShopeePay,"PROTEKSI barang yg muncul saat check out jangan di centang, itu bentuk penipuan. aneh banget, pembeli sudah centang proteksi. tp yg disuruh tanggungjawab malah seller. pihak shopee berusaha lari dr tanggung jawab.",1.0,2026-05-07 14:07:29,proteksi barang yg muncul saat check out jangan di centang itu bentuk penipuan aneh banget pembeli sudah centang proteksi tp yg disuruh tanggungjawab malah seller pihak shopee berusaha lari dr tanggung jawab,
PlayStore,ShopeePay,"di shopee semakin banyak seller yg gk amanah,barang tidak ada masih dipajang di etalase.ketika dibeli seller tidak mau membatalkan,tpi pembeli harus menunggu lama sampai dibatalkan sistem.jika dibiarkan akan sangat merugikan pihak shopee kedepannya.",3.0,2026-05-07 10:51:28,di shopee semakin banyak seller yg gk amanahbarang tidak ada masih dipajang di etalaseketika dibeli seller tidak mau membatalkantpi pembeli harus menunggu lama sampai dibatalkan sistemjika dibiarkan akan sangat merugikan pihak shopee kedepannya,
PlayStore,GoPay,"udah nunggu lama, driver ga dpt"" sekalinya dpt langsung dincancel, punya driver milih"" pada nolak rejeki, prioritas ataupun express ga ada gunanya kyk sama aja dengan biasa, memesan makan hampir 3 jam drivernya pada ngecancle ada masalah apa sii gojek dan gofood",1.0,2026-04-06 00:26:24,udah nunggu lama driver ga dpt sekalinya dpt langsung dincancel punya driver milih pada nolak rejeki prioritas ataupun express ga ada gunanya kyk sama aja dengan biasa memesan makan hampir  jam drivernya pada ngecancle ada masalah apa sii gojek dan gofood,
PlayStore,DANA,aplikasi DANA ini memang bagus banget,5.0,2026-05-08 12:36:12,aplikasi dana ini memang bagus banget,
PlayStore,GoPay,manttaabb,4.0,2026-04-17 11:58:57,manttaabb,
PlayStore,GoPay,is the best,5.0,2026-05-03 06:12:33,is the best,
PlayStore,GoPay,"ceoat tepat murah , untuk terus berinovasi .",5.0,2026-04-15 15:46:18,ceoat tepat murah  untuk terus berinovasi,
PlayStore,GoPay,mahaa bana anjiang,1.0,2026-04-29 22:25:14,mahaa bana anjiang,
PlayStore,ShopeePay,puas pelayanan nya,5.0,2026-05-08 19:15:28,puas pelayanan nya,
PlayStore,GoPay,"update teruss, ORANG PERLU URGENT JADI SUSAH, APK GA JELAS",1.0,2026-05-10 00:00:42,update teruss orang perlu urgent jadi susah apk ga jelas,
PlayStore,ShopeePay,good,5.0,2026-05-10 11:35:53,good,
PlayStore,DANA,oke mantapl,5.0,2026-05-09 01:12:31,oke mantapl,
PlayStore,GoPay,Berpergian yg aman & nyaman•,5.0,2026-04-15 14:55:03,berpergian yg aman  nyaman,
PlayStore,ShopeePay,belanja lebih mudah dan cepat,5.0,2026-05-07 22:11:15,belanja lebih mudah dan cepat,
PlayStore,ShopeePay,"bisa nggak sih jangan gencar banget ngeiklan,ganggu banget diapk lain klo ad iklan Shopee langsung masuk ke apk Shopeenya lagi.",1.0,2026-05-07 16:25:04,bisa nggak sih jangan gencar banget ngeiklanganggu banget diapk lain klo ad iklan shopee langsung masuk ke apk shopeenya lagi,
PlayStore,DANA,bagus sekali bisa simpan uang,5.0,2026-05-04 16:14:45,bagus sekali bisa simpan uang,
PlayStore,ShopeePay,suka banget akunya makasi shopee👍,5.0,2026-05-04 22:13:51,suka banget akunya makasi shopee,
PlayStore,GoPay,terkadang susah nyari driver,4.0,2026-05-08 14:47:25,terkadang susah nyari driver,
PlayStore,ShopeePay,"saya sangat suka belanja di shopee ,barang nya bagus ,dan kurir juga ramah .Tapi baru baru ini saya memesan parfum dan pas barang nya sampai parfum nya pecah ka tolang di koreksi lagi ya ka 🙏",5.0,2026-05-06 05:39:50,saya sangat suka belanja di shopee barang nya bagus dan kurir juga ramah tapi baru baru ini saya memesan parfum dan pas barang nya sampai parfum nya pecah ka tolang di koreksi lagi ya ka,
PlayStore,DANA,sejauh ini bagus bagus aja,4.0,2026-05-09 23:32:39,sejauh ini bagus bagus aja,
PlayStore,GoPay,Memudahkan jalan jalan,5.0,2026-04-24 10:32:34,memudahkan jalan jalan,
Quora,E-Wallet Discussion,Industrial Engineering (college major),,,industrial engineering college major,
PlayStore,ShopeePay,bagus saran saya banyakin barang yang harganya nol rupiah,5.0,2026-05-06 19:39:06,bagus saran saya banyakin barang yang harganya nol rupiah,
PlayStore,GoPay,"kalo hujan susah banget drivernya, padahal kan kita sama sama bayar juga",3.0,2026-04-30 22:27:02,kalo hujan susah banget drivernya padahal kan kita sama sama bayar juga,
PlayStore,GoPay,"Ok thanks gojek terima kasih memudahkan kami sebagai masyarakt. murah lagi, driver akurat semua tau jalan. semangat gojek bisa lebih baik lagi y",5.0,2026-04-25 23:33:49,ok thanks gojek terima kasih memudahkan kami sebagai masyarakt murah lagi driver akurat semua tau jalan semangat gojek bisa lebih baik lagi y,
PlayStore,DANA,aplikasi sangan bagus,5.0,2026-05-08 12:44:29,aplikasi sangan bagus,
PlayStore,GoPay,sesuai ekspektasi,5.0,2026-05-08 16:07:51,sesuai ekspektasi,
PlayStore,ShopeePay,kurirnya pemalas,1.0,2026-05-08 17:14:26,kurirnya pemalas,
PlayStore,ShopeePay,plis lah shopee bisa bayar pake dana juga i butuh bgtt minnn,3.0,2026-05-05 22:08:11,plis lah shopee bisa bayar pake dana juga i butuh bgtt minnn,
PlayStore,ShopeePay,mantap well,5.0,2026-05-06 10:08:47,mantap well,
PlayStore,GoPay,"aku habis belanja di gomart dan ada barang yang kosong, barangnya di kosongin tapi saldonya engga di balikin. trauma banget belanja disini, jangan belanja disini buat kalian yang engga mau kaya aku",1.0,2026-04-25 13:17:25,aku habis belanja di gomart dan ada barang yang kosong barangnya di kosongin tapi saldonya engga di balikin trauma banget belanja disini jangan belanja disini buat kalian yang engga mau kaya aku,
PlayStore,GoPay,sudah 5 kali pesan gofood. selama 2 jam an tapi nda ada yg ambil oleh drivernya. saya kecewa berat,1.0,2026-04-04 22:05:52,sudah  kali pesan gofood selama  jam an tapi nda ada yg ambil oleh drivernya saya kecewa berat,
PlayStore,GoPay,"tidak bisa membatalkan pesanan gofood karna tidak dapat driver lebih dari 20 menit, tidak ada pembatalan, lapor cs juga percuma, padahal saya pesan setelah hujan reda cukup lama, sangat kecewa pada penyedia aplikasi dan driver yang semakin manja",1.0,2026-04-11 20:28:17,tidak bisa membatalkan pesanan gofood karna tidak dapat driver lebih dari  menit tidak ada pembatalan lapor cs juga percuma padahal saya pesan setelah hujan reda cukup lama sangat kecewa pada penyedia aplikasi dan driver yang semakin manja,
PlayStore,ShopeePay,sll profesional 👍,5.0,2026-05-06 13:33:17,sll profesional,
PlayStore,GoPay,GOJEK MAHAL,1.0,2026-04-15 23:29:32,gojek mahal,
PlayStore,DANA,mantap....,5.0,2026-05-09 20:03:45,mantap,
PlayStore,ShopeePay,shopee is the best. sukses selalu,5.0,2026-05-10 05:39:28,shopee is the best sukses selalu,
PlayStore,DANA,info saldo dana saya kepotong,1.0,2026-05-08 19:22:51,info saldo dana saya kepotong,
PlayStore,ShopeePay,Dulu aplikasi ini sangat saya favoritkan. Seiring waktu sering update yg tidak jelas apa yg di update akhirnya aplikasinya semakin berat dan lemot. menguras batre. Terakhir menjadi aplikasi yg yg saya benci...,2.0,2026-05-10 10:08:06,dulu aplikasi ini sangat saya favoritkan seiring waktu sering update yg tidak jelas apa yg di update akhirnya aplikasinya semakin berat dan lemot menguras batre terakhir menjadi aplikasi yg yg saya benci,
PlayStore,GoPay,"aplikasi sangat lemot,susah di buka aplikasinya. tolong perbaiki lg. makasi",1.0,2026-05-04 09:49:48,aplikasi sangat lemotsusah di buka aplikasinya tolong perbaiki lg makasi,
PlayStore,ShopeePay,mantap bagus,5.0,2026-05-08 21:59:24,mantap bagus,
PlayStore,DANA,tolong fitur Qris nya di perbaiki ya dri kmren kmren blum bisa jugk heran aku apk sekelas dana bisa gini,4.0,2026-05-05 22:25:09,tolong fitur qris nya di perbaiki ya dri kmren kmren blum bisa jugk heran aku apk sekelas dana bisa gini,
PlayStore,GoPay,lama dapet driver gofood,1.0,2026-04-04 22:29:03,lama dapet driver gofood,
PlayStore,ShopeePay,"tolong batalkan pesanan saya, saya mohon dengan sangat pihak shopee bisa membantu",1.0,2026-05-05 13:13:43,tolong batalkan pesanan saya saya mohon dengan sangat pihak shopee bisa membantu,
PlayStore,GoPay,"sialan kenapa jaringan susah terus, lalu pakai hp milik istri kok bisa pakai hp ku susah nya minta ampun😡, ga bisa di andalkan lagi.",1.0,2026-04-10 13:42:16,sialan kenapa jaringan susah terus lalu pakai hp milik istri kok bisa pakai hp ku susah nya minta ampun ga bisa di andalkan lagi,
PlayStore,DANA,"dana setan ,ngisi brapa brapa d ambil trus ke aplikasi yang lain",1.0,2026-05-04 23:05:02,dana setan ngisi brapa brapa d ambil trus ke aplikasi yang lain,
PlayStore,DANA,saya sangat puas dengan aplikasi dana,5.0,2026-05-06 20:49:31,saya sangat puas dengan aplikasi dana,
PlayStore,ShopeePay,"apk kocak gua mau masukin no hp, gak bisa katanya sudah terdaftar giliran gua log in pake no hp akun terblokir, jelas itu no baru di pake belum daftar apa"",, kocak parah.... masih banyak ini platform belanja online di tempat lain",1.0,2026-05-05 20:31:50,apk kocak gua mau masukin no hp gak bisa katanya sudah terdaftar giliran gua log in pake no hp akun terblokir jelas itu no baru di pake belum daftar apa kocak parah masih banyak ini platform belanja online di tempat lain,
PlayStore,DANA,pelayanannya buruk sekali. dana saya hilang di bobol orang. pas saya melaporkan. tidak ada. selusi jalan keluar nya. kalo saldo dana nya kecil mah GPP ni mah 4019000 parah udh GK nyaman lagi pake. dana sekarang ni. GK bisa sekarang mah simpen dana. banyak 2,1.0,2026-05-08 23:15:02,pelayanannya buruk sekali dana saya hilang di bobol orang pas saya melaporkan tidak ada selusi jalan keluar nya kalo saldo dana nya kecil mah gpp ni mah  parah udh gk nyaman lagi pake dana sekarang ni gk bisa sekarang mah simpen dana banyak,
PlayStore,DANA,adanya aplikasi dana sangat membantu sekali apa lagu cara mengunskan aplikasi nya sangat mudah sekali jadi tidak merepot kan dan sangat mudah cuma pake nomor hp aja,5.0,2026-05-06 01:13:22,adanya aplikasi dana sangat membantu sekali apa lagu cara mengunskan aplikasi nya sangat mudah sekali jadi tidak merepot kan dan sangat mudah cuma pake nomor hp aja,
PlayStore,GoPay,SUPER DUPER LELET PADA GAJELAS,1.0,2026-04-25 23:13:57,super duper lelet pada gajelas,
PlayStore,GoPay,"makin kesini gjls,di apps tinggal 2 menit lg nyatanya sampe 10 menit masi ga dtg2",1.0,2026-04-06 09:28:03,makin kesini gjlsdi apps tinggal  menit lg nyatanya sampe  menit masi ga dtg,
PlayStore,DANA,sangat membantu banget.,5.0,2026-05-08 01:07:16,sangat membantu banget,
PlayStore,GoPay,b aja,5.0,2026-05-05 17:21:00,b aja,
PlayStore,ShopeePay,beli sedotan rasa strawbery tapi aku belum punya,5.0,2026-05-08 15:32:05,beli sedotan rasa strawbery tapi aku belum punya,
PlayStore,GoPay,Praktis,5.0,2026-04-14 14:16:23,praktis,
PlayStore,ShopeePay,tyguhhhhhkkvj ngomongo cobak BM d buk kelompokku knn PNPM-MP pppppppp pppppppp donk petinggi no 1swu⁷⁴⁵dvdy,4.0,2026-05-10 11:00:01,tyguhhhhhkkvj ngomongo cobak bm d buk kelompokku knn pnpmmp pppppppp pppppppp donk petinggi no swudvdy,
PlayStore,GoPay,"DARI AWAL TAHUN SISTEM BRANTAKAN!!! TOLONG PERBAIKI SISTEMNYA, SISTEM BRANTAKAN SEMUA. DRIVER JEMPUTNYA JAUH JAUH, PELANGGAN DAPET DRIVER JAUH JAUH, POTONGANNYA DAN BIAYA LAIN LAINNYA MENINGKAT HADEHHH",1.0,2026-04-10 11:59:32,dari awal tahun sistem brantakan tolong perbaiki sistemnya sistem brantakan semua driver jemputnya jauh jauh pelanggan dapet driver jauh jauh potongannya dan biaya lain lainnya meningkat hadehhh,
PlayStore,DANA,membantu mempermudah bertransaksi,5.0,2026-05-07 10:34:28,membantu mempermudah bertransaksi,
PlayStore,ShopeePay,belanja jauh lebih mudah dan aman.. terima kasih shoppe..,5.0,2026-05-08 12:40:53,belanja jauh lebih mudah dan aman terima kasih shoppe,
PlayStore,ShopeePay,Amanah,5.0,2026-05-10 11:30:57,amanah,
PlayStore,ShopeePay,bagus cepat,4.0,2026-05-07 12:28:20,bagus cepat,
PlayStore,GoPay,"makin lama makin ga jelas, orderan tiba2 tercancel sendiri, sudah dipesan ulang malah double orderan, AKU YANG DIMARAHIN DRIVER GOJEKNYA YA BUKAN KALIAN!!, kalian bilang bisa langsung cancel? itu gimana aku cancelnya lagi dijalan, udah sampe tujuan baru sadar aku itu dibuat double dari sistem kalian, kok jadi kesannya nyalahin saya ya?!",1.0,2026-04-12 00:44:23,makin lama makin ga jelas orderan tiba tercancel sendiri sudah dipesan ulang malah double orderan aku yang dimarahin driver gojeknya ya bukan kalian kalian bilang bisa langsung cancel itu gimana aku cancelnya lagi dijalan udah sampe tujuan baru sadar aku itu dibuat double dari sistem kalian kok jadi kesannya nyalahin saya ya,
PlayStore,ShopeePay,"lu benerin dah sistem pengiriman instan nya,pake layanan instan harus nya cepet sampai tapi gak sampai""sampe susah buat dapetin driver",1.0,2026-05-05 12:53:49,lu benerin dah sistem pengiriman instan nyapake layanan instan harus nya cepet sampai tapi gak sampaisampe susah buat dapetin driver,
PlayStore,GoPay,aplikasi apa ini ..saya mesen gacoan 1 knpa jadi double 2 pesanan melayang uang saya 200 ribu bukan Maslah uang nya ya tapi kcwa saya saya mesen satu kali knpa jadi double kcwa skli .,1.0,2026-04-10 13:22:58,aplikasi apa ini saya mesen gacoan  knpa jadi double  pesanan melayang uang saya  ribu bukan maslah uang nya ya tapi kcwa saya saya mesen satu kali knpa jadi double kcwa skli,
PlayStore,ShopeePay,"sejauh ini msh memuaskan , smoga dipertahankan",5.0,2026-05-08 11:30:32,sejauh ini msh memuaskan  smoga dipertahankan,
PlayStore,GoPay,aplikasi keren. dan sangat membantu saya. terutama kalo lagi.mager belanja ..,5.0,2026-04-11 05:27:53,aplikasi keren dan sangat membantu saya terutama kalo lagimager belanja,
PlayStore,GoPay,goo jod,5.0,2026-04-23 11:34:25,goo jod,
PlayStore,DANA,"hari ini sy kecewa, sy top-up dari BRIMO ke Dana 2 juta, di BRI sukses/berhasil tapi di Dana sm sekali gk masuk, biasanya gk begini, tolong dong di perbaiki sistemnya.",5.0,2026-05-05 14:29:35,hari ini sy kecewa sy topup dari brimo ke dana  juta di bri suksesberhasil tapi di dana sm sekali gk masuk biasanya gk begini tolong dong di perbaiki sistemnya,
Quora,E-Wallet Discussion,"Cryptocurrency wallets are digital tools that store the private and public keys needed to access and manage your crypto assets on a blockchain. They don't hold the actual coins, which exist on the distributed ledger, but enable secure interactions like sending, receiving, or viewing balances.",,,cryptocurrency wallets are digital tools that store the private and public keys needed to access and manage your crypto assets on a blockchain they dont hold the actual coins which exist on the distributed ledger but enable secure interactions like sending receiving or viewing balances,
PlayStore,DANA,"kenapa setiap buka riwayat pengiriman aja loading nya ga selesai2, KLO gini kan mau share bukti TF jadi ga bisa.. tolong di perbaiki supaya ga ngebug gajelas",1.0,2026-05-08 11:55:10,kenapa setiap buka riwayat pengiriman aja loading nya ga selesai klo gini kan mau share bukti tf jadi ga bisa tolong di perbaiki supaya ga ngebug gajelas,
PlayStore,ShopeePay,"tolonglah, yang aktif saat pertama kali buka aplikasi itu seharusnya beranda, bukan live dan video. itu fitur tidak penting, atau seharusnya ada pengaturan untuk menonaktifkan fitur tersebut. rating saya tingkatkan jika sudah diperbaiki, terimakasih",2.0,2026-05-08 14:16:59,tolonglah yang aktif saat pertama kali buka aplikasi itu seharusnya beranda bukan live dan video itu fitur tidak penting atau seharusnya ada pengaturan untuk menonaktifkan fitur tersebut rating saya tingkatkan jika sudah diperbaiki terimakasih,
PlayStore,GoPay,"selama pakai gojek aman"". thanks gojek",5.0,2026-04-18 18:34:12,selama pakai gojek aman thanks gojek,
PlayStore,ShopeePay,informasi awal tiba tidak tepat,3.0,2026-05-05 16:09:31,informasi awal tiba tidak tepat,
PlayStore,DANA,qris dipakai error terus,1.0,2026-05-05 23:59:59,qris dipakai error terus,
PlayStore,GoPay,"layanan darurat dijawab pake BOT ini mikirnya apa si sebenernya kebayang kalo konsumen di bawa kabur driver...keburu jadi korban konsumen kalian baru kalian respon... KECEWA BANGETTT SAMA APLIKASI INI, aplikasi ini gak save brti buat penumpang terutama yg order malam hari",1.0,2026-05-05 01:55:04,layanan darurat dijawab pake bot ini mikirnya apa si sebenernya kebayang kalo konsumen di bawa kabur driverkeburu jadi korban konsumen kalian baru kalian respon kecewa bangettt sama aplikasi ini aplikasi ini gak save brti buat penumpang terutama yg order malam hari,
PlayStore,DANA,sangan bangus,5.0,2026-05-06 11:36:24,sangan bangus,
PlayStore,GoPay,Ok banget,5.0,2026-05-10 12:21:04,ok banget,
PlayStore,GoPay,Sering² kasih diskon dong,5.0,2026-05-04 13:18:13,sering kasih diskon dong,
PlayStore,ShopeePay,pengiriman nya bisa cepat,5.0,2026-05-04 19:02:46,pengiriman nya bisa cepat,
PlayStore,ShopeePay,Berharap spaylater sm spinjam bisa di aktifkan kembali..🙏,5.0,2026-05-10 09:41:57,berharap spaylater sm spinjam bisa di aktifkan kembali,
PlayStore,GoPay,mantap deh pokoknya,5.0,2026-04-15 10:09:44,mantap deh pokoknya,
PlayStore,DANA,saldo nya suka tiba² lenyap gitu aja padahal ga melakukan transaksi apa apa. perbaiki lgi dong admin gmna si,1.0,2026-05-05 10:32:52,saldo nya suka tiba lenyap gitu aja padahal ga melakukan transaksi apa apa perbaiki lgi dong admin gmna si,
PlayStore,GoPay,supir nya banyak komplen ke customer karena masalah tarif nya. udh gitu gk pernah chat klo emang gk mau di ambil orderan. udh lama nunggu tau map nya berubah jauh.,2.0,2026-05-08 14:27:32,supir nya banyak komplen ke customer karena masalah tarif nya udh gitu gk pernah chat klo emang gk mau di ambil orderan udh lama nunggu tau map nya berubah jauh,
Quora,E-Wallet Discussion,MScs in Cryptocurrency from University of NicosiaAuthor has 139 answers and 51K answer views,,,mscs in cryptocurrency from university of nicosiaauthor has  answers and k answer views,
PlayStore,GoPay,ngelunjak,1.0,2026-04-04 20:37:51,ngelunjak,
PlayStore,ShopeePay,biar di baca telat notif nya tangal nya jga,5.0,2026-05-09 11:11:09,biar di baca telat notif nya tangal nya jga,
PlayStore,ShopeePay,belanja dengan shopee indonesia ngak bakslan kecewa,5.0,2026-05-07 21:15:00,belanja dengan shopee indonesia ngak bakslan kecewa,
PlayStore,DANA,"bagaimana caranya supaya limit dana instan dan dana cicil bisa naik? masa dari awal rilis selalu bertransaksi pakai dana,dan dana instan ataupun dana cicil sudah sering saya lunasi berkali-kali tapi limit masih aja segitu-segitu.",5.0,2026-05-08 22:26:10,bagaimana caranya supaya limit dana instan dan dana cicil bisa naik masa dari awal rilis selalu bertransaksi pakai danadan dana instan ataupun dana cicil sudah sering saya lunasi berkalikali tapi limit masih aja segitusegitu,
PlayStore,ShopeePay,"aneh beli tertulis haraga 81 ribu , trus di bawah total jd 91 ribu , eh pas sub total jd 108 ribu , semua itu di total dr mana kan tertulis harga 81 kok bisa ada tambahan lain2 , pdahal harus nya harga segitu , kalau di potong voucher 2 jd berkurang bnyk lho ada voucher 15 ribu dr toko , ada voucher dr diskon 25 ribu harus nya jd di bawah 81 ini malah jdi hampir 90 , males di Shopee skrng , bingung ngitung nya",1.0,2026-05-10 09:13:05,aneh beli tertulis haraga  ribu  trus di bawah total jd  ribu  eh pas sub total jd  ribu  semua itu di total dr mana kan tertulis harga  kok bisa ada tambahan lain  pdahal harus nya harga segitu  kalau di potong voucher  jd berkurang bnyk lho ada voucher  ribu dr toko  ada voucher dr diskon  ribu harus nya jd di bawah  ini malah jdi hampir   males di shopee skrng  bingung ngitung nya,
PlayStore,ShopeePay,terimakasih bagus sukses,5.0,2026-05-08 13:08:53,terimakasih bagus sukses,
PlayStore,ShopeePay,"gw beli apa apa di sini, dan bagus semua juga ada yang asli dan palsu sihh🤗",5.0,2026-05-07 16:08:50,gw beli apa apa di sini dan bagus semua juga ada yang asli dan palsu sihh,
PlayStore,ShopeePay,pokoknya kalian harus mendownload aplikasi ini karena sangat berguna,5.0,2026-05-04 20:11:33,pokoknya kalian harus mendownload aplikasi ini karena sangat berguna,
PlayStore,DANA,bagus tapi ga bisa berlangganan di yt knp ya?,3.0,2026-05-08 19:14:35,bagus tapi ga bisa berlangganan di yt knp ya,
PlayStore,GoPay,Helps me alots!,5.0,2026-04-24 19:17:04,helps me alots,
PlayStore,GoPay,sangat buruk sekarang pesen gocar aja 3x di cancel mulu sudah pake prioritas sama aja..,2.0,2026-05-04 12:20:09,sangat buruk sekarang pesen gocar aja x di cancel mulu sudah pake prioritas sama aja,
PlayStore,DANA,membantu 👍terbaik,5.0,2026-05-05 16:30:30,membantu terbaik,
PlayStore,GoPay,"kau yang buat apk gojek, benahin napa ni apk, aku pesen gomart tapi toko tutup, gak papa si toko tutup, masalahnya gak bisa di batalin, kalau driver yang cansel malah di lempar ke driver lain, gak bisa di batalin sama sekali, tu menu bantuan gak guna sama sekali sumpah. ni lama lama ku kasih bintang 1 juga ni apk.",3.0,2026-04-29 04:18:46,kau yang buat apk gojek benahin napa ni apk aku pesen gomart tapi toko tutup gak papa si toko tutup masalahnya gak bisa di batalin kalau driver yang cansel malah di lempar ke driver lain gak bisa di batalin sama sekali tu menu bantuan gak guna sama sekali sumpah ni lama lama ku kasih bintang  juga ni apk,
PlayStore,ShopeePay,concern sy cm Maslah video yg gak sesuai brg yg di jual.cm gimmick.byk org yg merasa tertipu,5.0,2026-05-06 12:08:16,concern sy cm maslah video yg gak sesuai brg yg di jualcm gimmickbyk org yg merasa tertipu,
PlayStore,DANA,kok di akun saya GK ada pinjem dana nya gimna ya?,1.0,2026-05-05 01:45:41,kok di akun saya gk ada pinjem dana nya gimna ya,
PlayStore,DANA,sangat 👍👍👍👍👍👍👍👍👍👍👍👍👍👍👍👍👍👍👍👍👍👍👍👍👍👍👍👍👍Baik,4.0,2026-05-07 09:24:13,sangat baik,
PlayStore,DANA,sangat membantu sekali apk ini trims ...,5.0,2026-05-07 21:10:13,sangat membantu sekali apk ini trims,
PlayStore,ShopeePay,apk ini menguntungkan saya karena sery dapat harga 0 rupiah,5.0,2026-05-04 22:21:04,apk ini menguntungkan saya karena sery dapat harga  rupiah,
PlayStore,ShopeePay,"Transfer shopee pay ke aplikasi dana sangat butuk, status di shopee sudah berhasil tetapi dana ga masuk sama sekali, jlsaldo shopee hangus ga bisa balik, giliran pengaduan, alasan layanannya selalu dalam perbaikan sistem, sampai kiamatpun ga perbaikan mulu, semoga rusak lah tu sistem biar ga perbaikan"" lg. Bertahun-tahun pake shopee baru kali ini pelayanannya burukkkk🗿🗿🗿",1.0,2026-05-07 14:56:19,transfer shopee pay ke aplikasi dana sangat butuk status di shopee sudah berhasil tetapi dana ga masuk sama sekali jlsaldo shopee hangus ga bisa balik giliran pengaduan alasan layanannya selalu dalam perbaikan sistem sampai kiamatpun ga perbaikan mulu semoga rusak lah tu sistem biar ga perbaikan lg bertahuntahun pake shopee baru kali ini pelayanannya burukkkk,
PlayStore,DANA,kenapa saldo akuberkurag,2.0,2026-05-05 20:14:18,kenapa saldo akuberkurag,
PlayStore,DANA,sangat membantu kali aku dana ni,5.0,2026-05-09 16:56:58,sangat membantu kali aku dana ni,
PlayStore,DANA,dana cicl gua ga muncul padahal udah lama pake dana. .,2.0,2026-05-04 22:09:11,dana cicl gua ga muncul padahal udah lama pake dana,
PlayStore,ShopeePay,aplikasi yang sangat membantu untuk mencari produk yang saya inginkan belanja secara online karna lebih hemat dan murah. apalagi tinggalnya didaerah luar pulau Jawa.,5.0,2026-05-04 16:45:17,aplikasi yang sangat membantu untuk mencari produk yang saya inginkan belanja secara online karna lebih hemat dan murah apalagi tinggalnya didaerah luar pulau jawa,
PlayStore,DANA,knp GK bisa ngirim uang dr 5ribu ?,5.0,2026-05-09 14:04:02,knp gk bisa ngirim uang dr ribu,
PlayStore,GoPay,"simple,drivernya juga ok",5.0,2026-04-07 21:07:20,simpledrivernya juga ok,
PlayStore,DANA,pln lebih baik dan cepat repon ya joss,5.0,2026-05-05 16:47:12,pln lebih baik dan cepat repon ya joss,
PlayStore,GoPay,bagos,5.0,2026-04-17 12:47:48,bagos,
PlayStore,GoPay,bakus,5.0,2026-05-05 20:28:58,bakus,
PlayStore,GoPay,Bapaknya Ramah dan hati²,5.0,2026-04-27 18:10:00,bapaknya ramah dan hati,
PlayStore,GoPay,"tolongg dong, aplikasi nya lemot bgtt lelett muncul nya padahal sinyal bagus, jdi kalo mau mesen apa2 jadi lamaa, perbaiki nanti ganti bintang",3.0,2026-04-07 21:04:55,tolongg dong aplikasi nya lemot bgtt lelett muncul nya padahal sinyal bagus jdi kalo mau mesen apa jadi lamaa perbaiki nanti ganti bintang,
PlayStore,DANA,saldo yang saya top tidak bertambah,1.0,2026-05-05 11:35:27,saldo yang saya top tidak bertambah,
PlayStore,ShopeePay,"Penanganan masalahnya tidak diberi kejelasan, pelayanan CS sangat buruk",1.0,2026-05-09 18:44:32,penanganan masalahnya tidak diberi kejelasan pelayanan cs sangat buruk,
PlayStore,ShopeePay,"WOII TURUNIN BIAYA LAYANAN SHOPEEFOOD LAHH GILAAA, DULU CUMA 2K TERUS NAIK 3K ISOKE LAHH INII SEKARANG 5K ANJJ KIKIRR UDAH MAH PROMO MAKIN SINI MAKIN ANCURRR HOK CCCUHHH",1.0,2026-05-07 01:31:49,woii turunin biaya layanan shopeefood lahh gilaaa dulu cuma k terus naik k isoke lahh inii sekarang k anjj kikirr udah mah promo makin sini makin ancurrr hok cccuhhh,
PlayStore,ShopeePay,mantap sangat membantu,5.0,2026-05-09 11:31:37,mantap sangat membantu,
PlayStore,ShopeePay,"terbantu banget dengn Shopee.. semuanya hampir beli Shopee.. berkah buat pengguna, kurir, penjual dan semuanya.. yang penting tetap. amanah terjaga kualitas, jng sampe. ada penjual nakal.",5.0,2026-05-05 17:28:23,terbantu banget dengn shopee semuanya hampir beli shopee berkah buat pengguna kurir penjual dan semuanya yang penting tetap amanah terjaga kualitas jng sampe ada penjual nakal,
PlayStore,GoPay,"interior bersih, nyaman, drivernya tenang, tidak rusuh",5.0,2026-05-01 13:53:50,interior bersih nyaman drivernya tenang tidak rusuh,
PlayStore,GoPay,cepet dan mudah d perguna kan,5.0,2026-04-17 20:54:08,cepet dan mudah d perguna kan,
