п»ҝsource,url,app_name,content,score
Quora,https://www.quora.com/How-do-e-wallets-work,E-Wallet Discussion,"A true crypto wallet is simply a way for you to visually see the assets that you unlock with a private key. In fact, most crypto clients originally didnвҖҷt even need a password (you could encrypt the wallet and then enter a password but that only required it on your device).",
Quora,https://www.quora.com/How-do-e-wallets-work,E-Wallet Discussion,"How does crypto wallet work? A cryptocurrency wallet secures the public and private keys that is needed to buy cryptocurrencies, and provides digital signatures authorizing each transaction. These digital wallets can be a device, a program on an app or online website, or a service offered by crypto exchanges.

How Much Does a Bitcoin Wallet Cost?

Using a Bitcoin wallet doesnвҖҷt cost you anything if youвҖҷre just storing Bitcoin in the wallet. However, if youвҖҷre completing a transaction, then the owner of the exchange or device that is housing your wallet will charge you various fees depending on wha

Continue Reading",
Quora,https://www.quora.com/How-do-e-wallets-work,E-Wallet Discussion,"In the background of the accounting ledger, there are managed bank accounts, which hold the actual money from customers (the ""view"" on this money from the perspective of a user is called ""eWallet""). ... Way to store credit cards, bank accounts and other payment instruments, so that the eWallet can be funded easily later.",
Quora,https://www.quora.com/How-do-e-wallets-work,E-Wallet Discussion,"Veer Surendra Sai University of Technology, Burla",
Quora,https://www.quora.com/How-do-e-wallets-work,E-Wallet Discussion,Author has 164 answers and 138.2K answer views,
Quora,https://www.quora.com/How-do-e-wallets-work,E-Wallet Discussion,"How does crypto wallet work? A cryptocurrency wallet secures the public and private keys that is needed to buy cryptocurrencies, and provides digital signatures authorizing each transaction. These digital wallets can be a device, a program on an app or online website, or a service offered by crypto exchanges.How Much Does a Bitcoin Wallet Cost? Using a Bitcoin wallet doesnвҖҷt cost you anything if youвҖҷre just storing Bitcoin in the wallet. However, if youвҖҷre completing a transaction, then the owner of the exchange or device that is housing your wallet will charge you various fees depending on what youвҖҷre trying to do. Purchasing a wallet could cost you anywhere from $0 to $200 or more. If youвҖҷre using a wallet as part of an exchange then youвҖҷll likely pay either a flat fee of a few dollars or a percentage of the total transaction value. How Do You Cash Out Your Bitcoin Wallet? You canвҖҷt convert Bitcoin to cash directly whenever you feel like it, but you can sell your Bitcoin anonymously on the blockchain in exchange for the fiat currency you desire. A crypto exchange can handle the transaction on your behalf and find a buyer so that you can quickly convert the value of your Bitcoin into the cash you need. Every wallet has different rules and time periods for transferring your fiat currency over to your bank account, but most can be done in 1 to 3 days after the Bitcoin sale is complete. Why You Need a Wallet You technically can store your crypto in the exchange where you bought it. Anyone who has bought small sums of cryptocurrency will typically see that it is stored in their account initially. It appears similar to a bank account balance. It will even have some layers of security. Cryptocurrency exchanges typically have insurance policies to protect against losses. Funds are also usually stored in FDIC-insured accounts. But these security measures wonвҖҷt help you if someone hacks into your account and transfers your crypto. Insurance policies held by your exchange wonвҖҷt cover this type of loss and your funds will be gone without a trace. click link to read more on How does a crypto paper wallet workhttp://oveainfostore.com.ng/most-used-crypto-wallets.html",
Quora,https://www.quora.com/How-do-e-wallets-work,E-Wallet Discussion,It could help you with your spending plan вҖ“,
Quora,https://www.quora.com/How-do-e-wallets-work,E-Wallet Discussion,"Related
What is the difference between m-wallet and e-wallet?",
Quora,https://www.quora.com/How-do-e-wallets-work,E-Wallet Discussion,3. Compatibility issues as some companies don't prefer payment with cash an,
Quora,https://www.quora.com/How-do-e-wallets-work,E-Wallet Discussion,Entrepreneur at AWordToTheWorld (2015вҖ“present),
Quora,https://www.quora.com/How-do-e-wallets-work,E-Wallet Discussion,"Related
What are the advantages of an eWallet?",
Quora,https://www.quora.com/How-do-e-wallets-work,E-Wallet Discussion,"Short answer? As many as you want. Longer answer? Yeah you can have as many as you want but the real question is, do you really want to. There can be benefits in joining a few because of certain circumstances but there isnвҖҷt much benefit in joining as many as you can for a вҖңjust becauseвҖқ. Do you really want to manage all of that or to remember each password for each e-wallet. Though if you need to sign up for multiple, only do so for the ones that you really need. Though if you donвҖҷt need one of them anymore, you could just keep it but monitor it once in awhile because itвҖҷs easier to maintain it vs closing it and then having to set all of that up again. With that said, you shouldnвҖҷt be asking yourself вҖңhow many e-wallets can I haveвҖқ, you should instead ask how many e-wallets that you actually really need. The reality of that is that you really just need 1 to 3 depending on your circ...",
Quora,https://www.quora.com/How-do-e-wallets-work,E-Wallet Discussion,"BKM Express is an e-wallet; an online service that can be used to make payments, rather than paying directly from the customer's card or bank account. At checkout, the customers select ""Pay with BKM Express"". They are then redirected to a BKM Express page, there they select which card they would like to pay with. An SMS is sent to their phone to approve the purchase.",
Quora,https://www.quora.com/How-do-e-wallets-work,E-Wallet Discussion,"We Had ""Loyalty Lists"" Every month, I'd get a report of customers who hadn't shopped around in 2+ years. These were our golden geese - we could raise their rates aggressively because they'd proven they wouldn't leave. One customer I remember was paying $3,200 annually for coverage that should have cost $1,800. She stayed for 5 years.",
Quora,https://www.quora.com/How-do-e-wallets-work,E-Wallet Discussion,"Financial Analyst, Crypto Trader & Writer Author has 356 answers and 824.3K answer views",
Quora,https://www.quora.com/How-do-e-wallets-work,E-Wallet Discussion,"There may be other functionality a wallet provides, but thats up",
Quora,https://www.quora.com/How-do-e-wallets-work,E-Wallet Discussion,"The ""File and Use"" Scam Here's something most people don't know: in many states, insurance companies can raise your rates immediately and ju",
Quora,https://www.quora.com/How-do-e-wallets-work,E-Wallet Discussion,1. Easily transfer money with just one tap.,
Quora,https://www.quora.com/How-do-e-wallets-work,E-Wallet Discussion,"Promoted by The Penny Hoarder
What's some brutally honest advice that everyone should know?
Lisa Dawson
Finance Writer at The Penny Hoarder
В В·В 
Updated 22h

HereвҖҷs the thing: I wish I had known these money secrets sooner. TheyвҖҷve helped so many people save hundreds, secure their familyвҖҷs future, and grow their bank accountsвҖ”myself included.

And honestly? Putting them to use was way easier than I had expected. I bet you can knock out at least three or four of these right nowвҖ”yes, even from your phone. DonвҖҷt wait like I did.

1. Cancel Your Car Insurance

You might not even realize it, but your car insurance company is probably overcharging you. In fact, theyвҖҷre kind of counting on you not noticing. Luckily, this problem is easy to fix.

DonвҖҷt waste your t

Continue Reading
Upvote
24.6K
2.1K
565",
Quora,https://www.quora.com/How-do-e-wallets-work,E-Wallet Discussion,"I have used almost all the major wallets that are prevalent in India. Over time, I have grown used to just a few. However, I change my usage preference based on the kind of transaction, the offers and the convenience it gives me.",
Quora,https://www.quora.com/How-do-e-wallets-work,E-Wallet Discussion,"Sponsored by 2Checkout
Looking for an international online payments solution?
Accept online payments from buyers worldwide. Simple, yet safe solution, with transparent pricing.
Sign Up
89",
Quora,https://www.quora.com/How-do-e-wallets-work,E-Wallet Discussion,"Yes, e-wallets can be used for both online and in-person transactions. In-person transactions can be made by using the e-wallet's mobile app to scan a QR code at the point of sale. For online transactions, the e-wallet can be used by logging into the merchant's website or mobile application and selecting the e-wallet as the payment method.",
Quora,https://www.quora.com/How-do-e-wallets-work,E-Wallet Discussion,"Now by owning this address you can have others вҖңsendвҖқ bitcoins to it. Anyone can send money to that address, they donвҖҷt have to know your name, location, or even if the address is owned by anyone at all. Your wallet software will automatically check the bitcoin blockchain (long ledger of transactions) to see if any coins were sent to your address (or if you spent any coins from that address).",
Quora,https://www.quora.com/How-do-e-wallets-work,E-Wallet Discussion,It requires your contraption to have a charge вҖ“,
Quora,https://www.quora.com/How-do-e-wallets-work,E-Wallet Discussion,You access to this information through a seed - for example about seed of 24 words or via a PIN or a password etc ...,
Quora,https://www.quora.com/How-do-e-wallets-work,E-Wallet Discussion,"So many, so much so that it is more likely that all of your electrons in your body ar",
Quora,https://www.quora.com/How-do-e-wallets-work,E-Wallet Discussion,An e-wallet allows you to save your money on your device in a digitized format and to use it you will need to download an e-wallet mobile app managed by a bank or a company.,
Quora,https://www.quora.com/How-do-e-wallets-work,E-Wallet Discussion,"КҖМІбҙҮМІбҙ„МІбҙҸМІбҙ МІбҙҮМІКҖМІЙӘМІЙҙМІЙўМІ МІТ“МІбҙңМІЙҙМІбҙ…МІsМІ МІКҹМІбҙҸМІsМІбҙӣМІ МІбҙӣМІбҙҸМІ МІбҙ„МІКҖМІКҸМІбҙҳМІбҙӣМІбҙҸМІбҙ„МІбҙңМІКҖМІКҖМІбҙҮМІЙҙМІбҙ„МІКҸМІ МІТ“МІКҖМІбҙҖМІбҙңМІбҙ…МІ МІЙӘМІsМІ МІбҙңМІЙҙМІбҙ…МІбҙҸМІбҙңМІКҷМІбҙӣМІбҙҮМІбҙ…МІКҹМІКҸМІ МІбҙ„МІКңМІбҙҖМІКҹМІКҹМІбҙҮМІЙҙМІЙўМІЙӘМІЙҙМІЙўМІ,МІ МІКҷМІбҙңМІбҙӣМІ МІбҙҳМІбҙҸМІsМІsМІЙӘМІКҷМІКҹМІбҙҮМІ МІбҙҸМІбҙңМІбҙӣМІбҙ„МІбҙҸМІбҙҚМІбҙҮМІsМІ МІбҙ„МІбҙҖМІЙҙМІ МІsМІбҙӣМІЙӘМІКҹМІКҹМІ МІКҷМІбҙҮМІ МІбҙҖМІбҙ„МІКңМІЙӘМІбҙҮМІбҙ МІбҙҮМІбҙ…МІ МІбҙңМІЙҙМІбҙ…МІбҙҮМІКҖМІ МІбҙӣМІКңМІбҙҮМІ МІКҖМІЙӘМІЙўМІКңМІбҙӣМІ МІбҙ„МІЙӘМІКҖМІбҙ„МІбҙңМІбҙҚМІsМІбҙӣМІбҙҖМІЙҙМІбҙ„МІбҙҮМІsМІ.МІ МІsМІбҙӣМІбҙҖМІКҸМІЙӘМІЙҙМІЙўМІ МІбҙҖМІКҹМІбҙҮМІКҖМІбҙӣМІ,МІ МІбҙ„МІбҙҖМІКҹМІбҙҚМІ,МІ МІбҙҖМІЙҙМІбҙ…МІ МІбҙҚМІбҙҮМІЙҙМІбҙӣМІбҙҖМІКҹМІКҹМІКҸМІ МІТ“МІбҙҸМІбҙ„МІбҙңМІsМІбҙҮМІбҙ…МІ МІбҙӣМІКңМІКҖМІбҙҸМІбҙңМІЙўМІКңМІбҙҸМІбҙңМІбҙӣМІ МІбҙӣМІКңМІбҙҮМІ МІбҙҳМІКҖМІбҙҸМІбҙ„МІбҙҮМІsМІsМІ МІбҙҳМІКҹМІбҙҖМІКҸМІsМІ МІбҙҖМІ МІбҙ„МІКҖМІбҙңМІбҙ„МІЙӘМІбҙҖМІКҹМІ МІКҖМІбҙҸМІКҹМІбҙҮМІ МІЙӘМІЙҙМІ МІбҙҚМІбҙҖМІбҙӢМІЙӘМІЙҙМІЙўМІ МІsМІбҙҸМІбҙңМІЙҙМІбҙ…МІ МІбҙ…МІбҙҮМІбҙ„МІЙӘМІsМІЙӘМІбҙҸМІЙҙМІsМІ МІбҙҖМІЙҙМІбҙ…МІ МІКҖМІбҙҮМІбҙ…МІбҙңМІбҙ„МІЙӘМІЙҙМІЙўМІ МІбҙӣМІКңМІбҙҮМІ МІКҖМІЙӘМІsМІбҙӢМІ МІбҙҸМІТ“МІ МІТ“МІбҙңМІКҖМІбҙӣМІКңМІбҙҮМІКҖМІ МІбҙҚМІбҙҖМІЙҙМІЙӘМІбҙҳМІбҙңМІ

Continue Reading",
Quora,https://www.quora.com/How-do-e-wallets-work,E-Wallet Discussion,"E-wallets are safe to use but they aren't 100% secure and they never will be. While it encrypts your personal and financial information, stored and protected on reliable servers, there is and ever will be an ever-present risk when dealing with money вҖ” similar to handling physical cash.",
Quora,https://www.quora.com/How-do-e-wallets-work,E-Wallet Discussion,Lives in The United Arab Emirates,
Quora,https://www.quora.com/How-do-e-wallets-work,E-Wallet Discussion,"Digital wallets are digital forms of your credit and debit cards kept in an app on your mobile device. Hold your phone near a suitable payment terminal, or make shops using the app when shopping on your device. You can indeed use your digital wallet to withdraw cash at enabled ATMs.

Digital payments, in apps like Venmo, Apple Pay, and Zelle, are faster, easier, and more reliable than some traditional payment methods. Still, more than half of all consumers are sticking with credit cards because they just don't depend on their mobile wallets.",
Quora,https://www.quora.com/How-do-e-wallets-work,E-Wallet Discussion,How does a multisig wallet work?,
Quora,https://www.quora.com/How-do-e-wallets-work,E-Wallet Discussion,All these transactions and more can be done through your digital wallet in addition to a lot of promotions that e-wallets can reward you with like cashback and other offers when you use their applications.,
Quora,https://www.quora.com/How-do-e-wallets-work,E-Wallet Discussion,"Like credit cards, bank accounts and other financial services, e-wallets can be used in place of cash for many kinds of commercial transactions.",
Quora,https://www.quora.com/How-do-e-wallets-work,E-Wallet Discussion,"In laymens terms, an electronic wallet. Google it for more in-depth details. There are several out there. Google play store is a good start.",
Quora,https://www.quora.com/How-do-e-wallets-work,E-Wallet Discussion,"they store your private keys that control your crypto. it's not actually storing coins, just the keys to access them on blockchain. lose keys = lose crypto forever",
Quora,https://www.quora.com/How-do-e-wallets-work,E-Wallet Discussion,"You donвҖҷt have to deal with tenants, repairs, or any of the hard stuff. The Flagship Fund takes care of it all, and you can track your progress anytime right from your phone. It only takes a few minutes to get started.*",
Quora,https://www.quora.com/How-do-e-wallets-work,E-Wallet Discussion,DonвҖҷt waste your time browsing insurance sites for a better deal. A company called Insurify shows you all your options at once вҖ” people who do this save up to $996 per year.,
Quora,https://www.quora.com/How-do-e-wallets-work,E-Wallet Discussion,Originally Answered: What are cryptocurrency wallets and how do they actually work?,
Quora,https://www.quora.com/How-do-e-wallets-work,E-Wallet Discussion,"A simple cryptocurrency wallet contains pairs of public and private cryptographic keys. The keys can be used to track ownership, receipt or spend cryptocurrencies.",
Quora,https://www.quora.com/How-do-e-wallets-work,E-Wallet Discussion,"A crypto paper wallet works like any other crypto wallet, but you would print it out on paper.

So, once you know which crypto you want to store (do your research as with everything) you can use a wallet generator to produce a paper wallet.

All the keys you need will then be stored on that wallet, you print it and keep it in a safe place. The downside of this is that anything can happen to paperвҖҰ It could get wet, or if you have a fireвҖҰitвҖҷs gone. But of course you could print out several copies and keep them safe, or alternatively store them on a USB stick that you keep offline until you need it,

Continue Reading",
Quora,https://www.quora.com/How-do-e-wallets-work,E-Wallet Discussion,Author has 356 answers and 824.3K answer views,
Quora,https://www.quora.com/How-do-e-wallets-work,E-Wallet Discussion,"Some experts make the distinction that e-wallets require money to be moved and loaded onto them prior to any transaction (online or offline), whereas digital wallets simply save the userвҖҷs card details for easy future transactions, with the money remaining in the userвҖҷs bank or card account.",
Quora,https://www.quora.com/How-do-e-wallets-work,E-Wallet Discussion,The average joe is a gullible one. With so much potential to teft and incredible amount of money if you manage to snack only one bitcoin this new virtual money revolution is atracting many crooks .,
Quora,https://www.quora.com/How-do-e-wallets-work,E-Wallet Discussion,"I have used almost all the major wallets that are prevalent in India. Over time, I have grown used to just a few. However, I change my usage preference based on the kind of transaction, the offers and the convenience it gives me.

For example, a store that does not accept Paytm but accepts Phonepe wallet, I use PhonePe. In that case, Phonepe is best. Why? Because I was able to buy the product without an interruption.

Paytm, Phonepe, Olamoney and others come with their own perks. I use them all and find them best when they allow me to complete a transaction successfully.

On a side note, I believe t

Continue Reading",
Quora,https://www.quora.com/How-do-e-wallets-work,E-Wallet Discussion,"On average, individuals might achieve debt freedom within 24 to 48 months. The sign-up process takes less than a minute to assess potential debt reduction options.",
Quora,https://www.quora.com/How-do-e-wallets-work,E-Wallet Discussion,"Suppose you have Rs1000/- in your ewallet from an issuer X. You can do transactions at various POS-terminals which accept this wallet. When you make your payment through the ewallet, the money without any hassle is moved to the transactor's ac",
Quora,https://www.quora.com/How-do-e-wallets-work,E-Wallet Discussion,"This is a paid advertisement. Carefully consider the investment objectives, risks, charges and expenses of the Fundrise Real Estate Fund before investing. This and other information can be found in the",
Quora,https://www.quora.com/How-do-e-wallets-work,E-Wallet Discussion,"Digital Wallet, or eWallet as called in Europe(an law) is in essence just an accounting system which describes financial transactions, not that different from the classical accounting system used by non-financial companies. In the background of the accounting ledger, there are managed bank accounts, which hold the actual money from customers (the ""view"" on this money from the perspective of a user is called ""eWallet"").

All the rest of the paraphernalia is the stuff you need in order to make the system described above, work in the real world.

So the eWallet platform would need to have also:


Way
Continue Reading",
Quora,https://www.quora.com/How-do-e-wallets-work,E-Wallet Discussion,"Signing up takes about one minute, and youвҖҷll immediately receive a $5 bonus to get you started.",
Quora,https://www.quora.com/How-do-e-wallets-work,E-Wallet Discussion,It might be used everything thought about retailers and online stores вҖ“,
Quora,https://www.quora.com/How-do-e-wallets-work,E-Wallet Discussion,"Despite most Turks currently using credit cards in transactions, this was expected to change rapidly. They now are seeking quicker, safer, and more convenient methods to pay for their purchases, also, it gives rise to the market penetration of E-wallet in Turkey. Let's take one of the most popular ones as an example: BKM Express. BKM Express is an e-wallet; an online service that can be used to make payments, rather than paying directly from the customer's card or bank account. At checkout, the customers select ""Pay with BKM Express"". They are then redirected to a BKM Express page, there they select which card they would like to pay with. An SMS is sent to their phone to approve the purchase. Additionally, BKM Express is one of a number of E-wallet payment methods that Payssion has bundled together for its clients on one integration. I believe it can introduce global enterprises and local users with a simple, secure, and convenient payment experience in Turkey. For further details, just drop them a line to discover more features.",
Quora,https://www.quora.com/How-do-e-wallets-work,E-Wallet Discussion,"B.E from SRM University, Kattankulathur (Graduated 2012)",
Quora,https://www.quora.com/How-do-e-wallets-work,E-Wallet Discussion,It's safe to say that decentralized wallets aren't really for beginne,
Quora,https://www.quora.com/How-do-e-wallets-work,E-Wallet Discussion,"There is more to it, but the rest is usually handled on the backend by your software. The main thing you need to worry about is keeping your wallet password protected, and keeping that password very difficult to crack. For the newbie, I usually recommend Multibit Classic, then Armory for the more experienced user (with cold storage).",
Quora,https://www.quora.com/How-do-e-wallets-work,E-Wallet Discussion,"An e-wallet is a prepaid online account, accessed via a mobile app or a desktop, which allows a user (an individual or company) to deposit and store money (which then becomes e-money) for any future online transaction, with the option of later withdrawing it.

Some experts make the distinction that e-wallets require money to be moved and loaded onto them prior to any transaction (online or offline), whereas digital wallets simply save the userвҖҷs card details for easy future transactions, with the money remaining in the userвҖҷs bank or card account.

E-wallet company is not a bank but regulated by f

Continue Reading",
Quora,https://www.quora.com/How-do-e-wallets-work,E-Wallet Discussion,"Ph.D in Informatics & Investing, University of California, Berkeley (Graduated 2012)",
Quora,https://www.quora.com/How-do-e-wallets-work,E-Wallet Discussion,"Bitcoin wallets enable the sending and receiving of the cryptocurrency by adhering to the Bitcoin protocol. A Bitcoin wallet is a unique digital ID used by the Bitcoin blockchain to keep track of how much BTC you own. Each wallet has a corresponding private key, which is required to transfer your BTC out of the Bitcoin wallet in order to purchase/trade. Bitcoin wallet addresses are public, but the corresponding private keys are secret and could only be guarded closely to ensure the best Bitcoin wallet security. Wallets are often accessed via the web, desktop, or mobile applications, or hardware devices.",
Quora,https://www.quora.com/How-do-e-wallets-work,E-Wallet Discussion,"Oh boy, where do I even start? After 8 years as an auto insurance agent, I have zero loyalty left to protect these companies.

We Had ""Loyalty Lists"" Every month, I'd get a report of customers who hadn't shopped around in 2+ years. These were our golden geese - we could raise their rates aggressively because they'd proven they wouldn't leave. One customer I remember was paying $3,200 annually for coverage that should have cost $1,800. She stayed for 5 years.

The ""File and Use"" Scam Here's something most people don't know: in many states, insurance companies can raise your rates immediately and ju

Continue Reading",
Quora,https://www.quora.com/How-do-e-wallets-work,E-Wallet Discussion,allows you to save your money on your device in a digitized format and to use it,
Quora,https://www.quora.com/How-do-e-wallets-work,E-Wallet Discussion,How Do You Cash Out Your Bitcoin Wallet?,
Quora,https://www.quora.com/How-do-e-wallets-work,E-Wallet Discussion,"Various electronic wallets offer inspirations to ask clients to use them as opposed to traditional portion procedures. You may find limits apply to explicit purchases, for instance, fuel, food, or travel. A couple of associations may work with your e-wallet to provide for offer unequivocal cutoff points moreover. That suggests you can put aside money without changing your methods of overseeing cash. YouвҖҷre just changing how you pay for those things.",
Quora,https://www.quora.com/How-do-e-wallets-work,E-Wallet Discussion,Author has 319 answers and 655.6K answer views,
Quora,https://www.quora.com/How-do-e-wallets-work,E-Wallet Discussion,Open wallets can be used for purchase of goods and services including financial,
