п»ҝsource,url,app_name,content,score
Quora,https://www.quora.com/How-secure-are-digital-wallets,E-Wallet Discussion,"Chapter two of this book.

The Cryptocurrency Investing Standard explains all the wallets and their safety. It equips you with wallets that rule out loss of funds.

Here is the link to the book and it's free

Amazon.com: The Cryptocurrency Investing Standard: How to use the Four Pillars of Cryptocurrency Investing to build effortless wealth eBook : Allan, Arinaitwe: Kindle Store
https://www.amazon.com/dp/B09JYQ432W

Check it out",
Quora,https://www.quora.com/How-secure-are-digital-wallets,E-Wallet Discussion,"LetвҖҷs be real вҖ” the usual advice about skipping lattes or canceling Netflix is a joke. The cost of living has gone feral, and a $6 coffee isnвҖҷt the reason most of us are broke. If you actually want to survive right now, you need tricks that feel a little off the rails вҖ” like slashing bills you didnвҖҷt even know were ripping you off, or getting paid for stuff you already waste time on anyway. ItвҖҷs not glamorous, but it works. Here are the вҖңunhingedвҖқ money moves that actually make a dent. 1. Cancel Your Car Insurance You might not even realize it, but your car insurance company is probably overcharging you. In fact, theyвҖҷre kind of counting on you not noticing. Luckily, this problem is easy to fix. DonвҖҷt waste your time browsing insurance sites for a better deal. A company called Insurify shows you all your options at once вҖ” people who do this save up to $1,025 per year. If you tell them a bit about yourself and your vehicle, theyвҖҷll send you personalized quotes so you can compare them and find the best one for you. No phone calls. No spam. Just happy customers (4.7 rating on Trustpilot). Tired of overpaying for car insurance? It takes just five minutes to compare your options with Insurify and see how much you could save on car insurance. 2. Get $300 To Cut Your Internet Bill to as Little as $35/Month There are some bills you just canвҖҷt avoid. For most of us, that includes our internet bill. But with T-Mobile, you can get high-speed, 5G home internet for as little as $35 a month. TheyвҖҷll even let you try it out for 15 days to see if you like it. If not, youвҖҷll get your money back. You donвҖҷt even have to worry about breaking up with your current provider вҖ” T-Mobile will pay up to $750 in termination fees. Even better? When you switch now, youвҖҷll get $300 back via prepaid MasterCard. Just enter your address and phone number here to see if you qualify. 3. You Can Start Investing in Real Estate for Just $10 You donвҖҷt need to be a millionaire or know how to be a landlord to invest in real estate. With the Fundrise Flagship Fund, you can start with just $10 and let your money do the work for you. So where does your $10 go? The Flagship Fund pools money from everyday investors and uses it to buy and manage real estate, things like apartment buildings or housing developments. As these properties earn money, you could receive quarterly dividends or watch your investment grow over time. You donвҖҷt have to deal with tenants, repairs, or any of the hard stuff. The Flagship Fund takes care of it all, and you can track your progress anytime right from your phone. It only takes a few minutes to get started.* You can join the Fundrise Flagship Fund today and start building wealth with just $10. 4. Set Up Direct Deposit вҖ” Pocket $400 When you set up direct deposit with SoFi Checking and Savings (Member FDIC), theyвҖҷll put up to $400 straight into your account. NoвҖҰ really. Just a nice little bonus for making a smart switch. Why switch? With SoFi, you can earn up to 3.30% APY on savings and 0.50% on checking, plus a 0.70% APY boost for your first 6 months when you set up direct deposit or keep $5K in your account. ThatвҖҷs up to 4.00% APY total. Way better than letting your balance chill at 0.40% APY. ThereвҖҷs no fees. No gotchas. Make the move to SoFi and get paid to upgrade your finances. *This is a paid advertisement. Carefully consider the investment objectives, risks, charges and expenses of the Fundrise Flagship Fund before investing. This and other information can be found in the FundвҖҷs prospectus. Read them carefully before investing.",
Quora,https://www.quora.com/How-secure-are-digital-wallets,E-Wallet Discussion,"The lock: The latest from this Silicon Valley-based technology company is a series of smart locks, including the Secure Lux, Secure Plus and Secure Pro variations",
Quora,https://www.quora.com/How-secure-are-digital-wallets,E-Wallet Discussion,"Even better? When you switch now, youвҖҷll get $300 back via prepaid MasterCard.",
Quora,https://www.quora.com/How-secure-are-digital-wallets,E-Wallet Discussion,"B.Com ,B.TH in Christian Theology and Philo at High Schools (2000вҖ“present)",
Quora,https://www.quora.com/How-secure-are-digital-wallets,E-Wallet Discussion,", you can see for yourself that your assets are 100% backed and secure.",
Quora,https://www.quora.com/How-secure-are-digital-wallets,E-Wallet Discussion,"Indian Institute of Information Technology and Management, Gwalior (IIITMG)",
Quora,https://www.quora.com/How-secure-are-digital-wallets,E-Wallet Discussion,Thank you your precious time.    NOTE:- Please ignore grammatical errors since my english is weak.,
Quora,https://www.quora.com/How-secure-are-digital-wallets,E-Wallet Discussion,"Compared to traditional locks, digital locks offer significantly higher security. By installing a fingerprint lock on the front door, you longer have to carry a set of keys. These locks rely on biometrics for unlocking, ensuring that security is never compromised. Digital security locks guarantee that only authorized family members can gain access. Some locks even have a smart freeze mode, temporarily disabling the lock when an incorrect password is entered more than 4 times.

The primary concern for homeowners regarding fingerprint locks is the cost, as their advanced features often result in h

Continue Reading",
Quora,https://www.quora.com/How-secure-are-digital-wallets,E-Wallet Discussion,"ItвҖҷs a legitimate question, given the recent spike in cryptocurrency trading and governmentsвҖҷ struggles to keep up with consistent regulation. CryptocurrencyвҖҷs securityвҖ”or lack thereofвҖ”will likely continue to be a more pressing issue in the years ahead, as a recent",
Quora,https://www.quora.com/How-secure-are-digital-wallets,E-Wallet Discussion,"Related
How secure are DeFi wallets?",
Quora,https://www.quora.com/How-secure-are-digital-wallets,E-Wallet Discussion,"You donвҖҷt have to deal with tenants, repairs, or any of the hard stuff. The Flagship Fund takes care of it all, and you can track your progress anytime right from your phone. It only takes a few minutes to get started.*",
Quora,https://www.quora.com/How-secure-are-digital-wallets,E-Wallet Discussion,How secure are digital wallets and associated transactions?,
Quora,https://www.quora.com/How-secure-are-digital-wallets,E-Wallet Discussion,"The technology: Six door access channels include a patented digital keypad, 3D fingerprint, mobile app, integration with the Amazon Alexa and Google Home voice assistants, and RFID card",
Quora,https://www.quora.com/How-secure-are-digital-wallets,E-Wallet Discussion,Look for Secret Dating Profiles,
Quora,https://www.quora.com/How-secure-are-digital-wallets,E-Wallet Discussion,"Algorithm to facilitate this service:Step1: Paytm will have to collaborate with some very popular social networking site such as Whatsapp.Step2: Now all most every Smartphone users use whatsapp so it will provide common platform between the customers and merchants.Step3:  Paytm will provide the credit to the customers as well as merchants which will be used to pay by customers and sometime to return the money by merchants. Step4: Now customer and merchants will be connected with each other within a fraction of time and payment will be done very easily.This is what digital wallet is. And to avail this facility, we will have to follow certain policy like-Paytm policy: 1- Customer need to have a credit card",
Quora,https://www.quora.com/How-secure-are-digital-wallets,E-Wallet Discussion,Former Author at Amazon Kindle Direct Publishing,
Quora,https://www.quora.com/How-secure-are-digital-wallets,E-Wallet Discussion,"Related
Are digital wallets safe?",
Quora,https://www.quora.com/How-secure-are-digital-wallets,E-Wallet Discussion,"Digital Wallet, or eWallet as called in Europe(an law) is in essence just an accounting system which describes financial transactions, not that different from the classical accounting system used by non-financial companies. In the background of the accounting ledger, there are managed bank accounts, which hold the actual money from customers (the ""view"" on this money from the perspective of a user is called ""eWallet"").

All the rest of the paraphernalia is the stuff you need in order to make the system described above, work in the real world.

So the eWallet platform would need to have also:


Way
Continue Reading",
Quora,https://www.quora.com/How-secure-are-digital-wallets,E-Wallet Discussion,"Related
Are digital wallets more secure or not?",
Quora,https://www.quora.com/How-secure-are-digital-wallets,E-Wallet Discussion,How do we guarantee the security of these systems?,
Quora,https://www.quora.com/How-secure-are-digital-wallets,E-Wallet Discussion,Are smart door locks safe and secure?,
Quora,https://www.quora.com/How-secure-are-digital-wallets,E-Wallet Discussion,The key used to encrypt your information is generated from your password. eWallet,
Quora,https://www.quora.com/How-secure-are-digital-wallets,E-Wallet Discussion,"I think that trust wallet is the best option at the moment. Despite minor flaws, it is quite simple, convenient and reliable. Also Metamask is not bad. The biggest advantage of Metamask is that it has a PC plugin that TW doesn't have yet. Otherwise, it is also not bad, but I still think that TW is much more convenient. You can also store assets there on SOL, LUNA and other networks that Metamask does not support.",
Quora,https://www.quora.com/How-secure-are-digital-wallets,E-Wallet Discussion,"Oh boy, where do I even start? After 8 years as an auto insurance agent, I have zero loyalty left to protect these companies.

We Had ""Loyalty Lists"" Every month, I'd get a report of customers who hadn't shopped around in 2+ years. These were our golden geese - we could raise their rates aggressively because they'd proven they wouldn't leave. One customer I remember was paying $3,200 annually for coverage that should have cost $1,800. She stayed for 5 years.

The ""File and Use"" Scam Here's something most people don't know: in many states, insurance companies can raise your rates immediately and ju

Continue Reading",
Quora,https://www.quora.com/How-secure-are-digital-wallets,E-Wallet Discussion,"The primary concern for homeowners regarding fingerprint locks is the cost, as their advanced features often result in higher prices. When choosing the best smart door lock, Ozone is a good choice. It has a wide range of fingerprint locks at competitive prices, you can have a look at those and choose the best for you.",
Quora,https://www.quora.com/How-secure-are-digital-wallets,E-Wallet Discussion,Only one I am aware of and use is PayTM. I also use a prepaid Visa debit card called вҖңNiyo GlobalвҖқ. I use both quite extensively. Of course for different purposes and in entirely unrelated area. In either of them my risk is limited to current balance.,
Quora,https://www.quora.com/How-secure-are-digital-wallets,E-Wallet Discussion,I have been into this field for last 8 years.,
Quora,https://www.quora.com/How-secure-are-digital-wallets,E-Wallet Discussion,MScs in Cryptocurrency from University of Nicosia,
Quora,https://www.quora.com/How-secure-are-digital-wallets,E-Wallet Discussion,Open wallets can be used for purchase of goods and services including financial,
Quora,https://www.quora.com/How-secure-are-digital-wallets,E-Wallet Discussion,Certified Home Insurance Advisor at Rocket Mortgage,
Quora,https://www.quora.com/How-secure-are-digital-wallets,E-Wallet Discussion,Author has 1.6K answers and 723.4K answer views,
Quora,https://www.quora.com/How-secure-are-digital-wallets,E-Wallet Discussion,Smart locks are gradually finding their way into peopleвҖҷs homes but the most recent versions of these wirelessly connected security devices may accelerate the rate of adoption by consumers.,
Quora,https://www.quora.com/How-secure-are-digital-wallets,E-Wallet Discussion,"There was the time when people have to wait to receive their money orders from their close one. Then they utilize the money for their need. Sometime it takes more than a month to get the needy. System develops people get the money by bank account within a day and latter within hours. But now I want to emphasis the development in e-commerce particularly for the payment.
Now a day we all need is to make our mind and things will be around you. It is all brought to us because of the time lapse and convenience in primitive. Revolution is always brought by a certain idea. And this ide

Continue Reading",
Quora,https://www.quora.com/How-secure-are-digital-wallets,E-Wallet Discussion,Dating Safety and Cheater Buster Tool,
Quora,https://www.quora.com/How-secure-are-digital-wallets,E-Wallet Discussion,"Way to trigger payments, and make transfers to other eWallet. In eWallet universe, there is not much difference between customers and merchants, it's just an accounting ledger; the payment from customer to merchant is just a database update, as all the money is already there (in the bank account)",
Quora,https://www.quora.com/How-secure-are-digital-wallets,E-Wallet Discussion,Author has 263 answers and 231.9K answer views,
Quora,https://www.quora.com/How-secure-are-digital-wallets,E-Wallet Discussion,Software Engineer at Infosys Limited (2024вҖ“present),
Quora,https://www.quora.com/How-secure-are-digital-wallets,E-Wallet Discussion,Blockchain is maybe best perceived as a decentralized record that can lessen costs by eliminating mediators like banks and successfully decentralizing trust. The innovation annexes passages to the record which are approved by the more extensive client local area rather than by a focal power.,
Quora,https://www.quora.com/How-secure-are-digital-wallets,E-Wallet Discussion,ItвҖҷs important not to accuse them without solid evidence. People who are cheating or hiding something will deny it if you have nothing to back up your suspicions. This is why itвҖҷs better to gather your facts quietly first.,
Quora,https://www.quora.com/How-secure-are-digital-wallets,E-Wallet Discussion,Software Engineer at Infosys Limited (2024вҖ“present)Author has 2.3K answers and 2.4M answer views,
Quora,https://www.quora.com/How-secure-are-digital-wallets,E-Wallet Discussion,"Yes, itвҖҷs absolutely possible to find out who your boyfriend or girlfriend is messaging вҖ” but the smartest way to do it is to quietly gather information without them knowing. HereвҖҷs how you can figure it out without creating a huge fight:

Start with a Reverse Phone Lookup

рҹ‘ү SEE WHO THEYвҖҷRE TEXTING HERE
If youвҖҷve noticed any suspicious numbers in their phone or if theyвҖҷve been texting someone a lot, you can enter the number here. It will show you who owns the number, their name, location, and even connected social profiles. This is the fastest way to see who theyвҖҷre talking to without making th

Continue Reading",
Quora,https://www.quora.com/How-secure-are-digital-wallets,E-Wallet Discussion,"So how do we have the best solution? The one way is to encourage competition so that the best solutions emerge. There are many security and authentication services and approaches on the market. An open and competitive wallet platform involves not relying on a single security service or technology for the wallet but rather allowing people to choose from a wide variety of different services. If we feel confident in SMS verification, we can use that. If we want fingerprints or some other biometric, we can use that. The open approach will also allow for the community to validate and recommend the best solutions to ensure that we are the only ones able to access our wallet.",
Quora,https://www.quora.com/How-secure-are-digital-wallets,E-Wallet Discussion,"вҖңSafeвҖқ is relative. The safest wallets are hardware wallets such as Ledger and Trezor. They do not rely on your PC being free of malware to be safe. Still, you need to verify that the address youвҖҷre sending to is the one you mean to send to. That step, no one can do for you. Online wallets I wouldnвҖҷt trust. Software wallets such as Electrum can be safe but require additional diligence. People have been scammed out of their coins because what they thought was a legit version, wasnвҖҷt. Verifying the GPG key is not an optional step; and also not intuitive to most folk. My recommendation: Ledger Nano S if you have a PC and only need a handful of coins; Ledger Nano X if you keep a broad portfolio of different coins and want access with your cell phone.",
Quora,https://www.quora.com/How-secure-are-digital-wallets,E-Wallet Discussion,"According to research, some of the best crypto wallets are Coinbase Wallet, Ledger, Exodus ,Trust Wallet and Binance US.",
Quora,https://www.quora.com/How-secure-are-digital-wallets,E-Wallet Discussion,Are custodial wallets really secure?,
Quora,https://www.quora.com/How-secure-are-digital-wallets,E-Wallet Discussion,Just enter your address and phone number here to see if you qualify.,
Quora,https://www.quora.com/How-secure-are-digital-wallets,E-Wallet Discussion,) license for opening and using Semi Closed wallets.,
Quora,https://www.quora.com/How-secure-are-digital-wallets,E-Wallet Discussion,Author has 51 answers and 43.6K answer views,
Quora,https://www.quora.com/How-secure-are-digital-wallets,E-Wallet Discussion,"There are some bills you just canвҖҷt avoid. For most of us, that includes our internet bill. But with T-Mobile, you can get high-speed, 5G home internet for as little as $35 a month.",
Quora,https://www.quora.com/How-secure-are-digital-wallets,E-Wallet Discussion,What's your most unhinged advice to combat the insane cost of living?,
Quora,https://www.quora.com/How-secure-are-digital-wallets,E-Wallet Discussion,What methods are used to secure digital wallets and transactions?,
Quora,https://www.quora.com/How-secure-are-digital-wallets,E-Wallet Discussion,"All the rest of the paraphernalia is the stuff you need in order to make the system described above, work in the real world.",
Quora,https://www.quora.com/How-secure-are-digital-wallets,E-Wallet Discussion,"Bitcoin wallets vary in security depending on factors like the type of wallet and user practices. Generally, hardware wallets offer higher security than software wallets due to their offline storage. However, all wallets are susceptible to cyber attacks if proper security measures aren't followed, such as using strong passwords, enabling two-factor authentication, and keeping software updated and whenever you become a victim of any cyber hack attack you can also reach out for guidance on how to set Security tracks with your bitcoin wallets",
Quora,https://www.quora.com/How-secure-are-digital-wallets,E-Wallet Discussion,"ItвҖҷs a legitimate question, given the recent spike in cryptocurrency trading and governmentsвҖҷ struggles to keep up with consistent regulation. CryptocurrencyвҖҷs securityвҖ”or lack thereofвҖ”will likely continue to be a more pressing issue in the years ahead, as a recent report from Allied Market Research projects the global crypto market to more than triple by 2030. The answer to how safe crypto actually is, at least for now, is complicated. Yes, cryptocurrency does come with some security risks that you should know about before making your first trade. Firstly, crypto is still an extremely volatile asset class, prone to roller-coaster fluctuations in price. Secondly, this relatively newвҖ”and relatively unregulatedвҖ”financial ecosystem comes with its share of scammers looking to prey on unsuspecting newcomers. But crypto has some security benefits that make it appealing as well. In this article, weвҖҷll review the main security points you should know before diving deeper into crypto",
Quora,https://www.quora.com/How-secure-are-digital-wallets,E-Wallet Discussion,How secure are digital wallets compared to traditional bank accounts?,
Quora,https://www.quora.com/How-secure-are-digital-wallets,E-Wallet Discussion,"Online wallets are good against hardware failures or the loss of your mobile phone. With an online wallet, your cryptocurrency is available online through any device. However, since it is an online service, it is also vulnerable to hacking, so try to choose a password safe enough to protect your wallet.",
Quora,https://www.quora.com/How-secure-are-digital-wallets,E-Wallet Discussion,"Anything that is вҖңregulatedвҖқ by the SEC can be seized by any arm of the government (US government). This applies to your countryвҖҷs equivalent of the SEC. If they regulate the exchange, they regulate the accounts. At any point, they can decide that you are a вҖҳnot goodвҖҷ person and freeze your account.",
Quora,https://www.quora.com/How-secure-are-digital-wallets,E-Wallet Discussion,"There was the time when people have to wait to receive their money orders from their close one. Then they utilize the money for their need.  Sometime it takes more than a month to get the needy. System develops people get the money by bank account within a day and latter within hours. But now I want to emphasis the development in e-commerce particularly for the payment.              Now a day we all need is to make our mind and things will be around you. It is all brought to us because of the time lapse and convenience in primitive. Revolution is always brought by a certain idea. And this idea for the e-commerce is brought by Mr. Akhil Shekhar Sharma. Mr. Sharma was a deprived person in his childhood and he didnвҖҷt know English well. So to overcome this problem he used to read both of English and Hindi book at the same time. He generally correlates English and Hindi to get a proper meaning of a particular word. For example samikaran means equation. While he is practicing it very hard, sometimes he left the Hindi book behind and go ahead with English. One will wonder that why I am narrating this story. The reason is Mr. Sharma approach to use the same principle at the bigger platforms. It is offline and online payment method which is popularly known as O2O.     Now Paytm introduces a new concept in e-commerce sector that is digital wallet. There was the time when Paytm is just used to recharge the mobile phone services. Steadily but surely Paytm become payment gateway for more than 80 MNCs including Amazon India, Ola cab and Food panda.      Paytm is working for the digital wallet. To completely bring this concept in reality it introduces a wallet from which you can pay the money just entering the amount to pay and go. There was gap between online and offline market. People who are purchasing product of lesser amounts donвҖҷt want to share all the account information leads to the offline options. And many people donвҖҷt carry the money so they prefer to the amount online. This gap is continually going on without minimizing this gap. So PaytmвҖҷs concept is as follows: вҖӢ вҖӢ вҖӢвҖӢ                                                                                                          How to facilitate this service to such a large no. of customers and merchants especially under privileged ones? Algorithm to facilitate this service:Step1: Paytm will have to collaborate with some very popular social networking site such as Whatsapp.Step2: Now all most every Smartphone users use whatsapp so it will provide common platform between the customers and merchants.Step3:  Paytm will provide the credit to the customers as well as merchants which will be used to pay by customers and sometime to return the money by merchants. Step4: Now customer and merchants will be connected with each other within a fraction of time and payment will be done very easily.This is what digital wallet is. And to avail this facility, we will have to follow certain policy like-Paytm policy: 1- Customer need to have a credit card 2- PaytmвҖҷs credit will be different from the bankвҖҷs credit .But PaytmвҖҷs credit amount allotted to customer will depend on his/her bank credit amount.                        3-Smaller amount up to Rs5000/-will be allotted to the customer without documentation and higher amount one will have to go through documentation. So this is about the PaytmвҖҷs new payment system which is known as O2O. And it brings the concept of digital wallet. Here we want to inform you that this project is building and hope it will work very soon.          Thank you your precious time.    NOTE:- Please ignore grammatical errors since my english is weak.",
Quora,https://www.quora.com/How-secure-are-digital-wallets,E-Wallet Discussion,Personal Finance Writer at The Penny Hoarder (2010вҖ“present),
Quora,https://www.quora.com/How-secure-are-digital-wallets,E-Wallet Discussion,How secure are bitcoin wallets from cyber attacks?,
Quora,https://www.quora.com/How-secure-are-digital-wallets,E-Wallet Discussion,in the order of вҖңsecureвҖқ from least to most:,
Quora,https://www.quora.com/How-secure-are-digital-wallets,E-Wallet Discussion,"While a trusted exchange is relatively вҖңsafeвҖқ to store coins, risks are higher that in the event the platform has some troubles your coins will become unavailable.",
