п»ҝsource,url,app_name,content,score
Quora,https://www.quora.com/How-do-e-wallets-work,E-Wallet Discussion,Here the main concept works E-wallet is to lure the small amounts of cash in the people pocket in to E-wallet companies bank account by handling their small transactions and offering attractive offers and cash backs. So that E-wallet companies can be profitable by handling huge cash in the form of small transactions from a huge number of people.,
Quora,https://www.quora.com/How-do-e-wallets-work,E-Wallet Discussion,"University of California, Los Angeles",
Quora,https://www.quora.com/How-do-e-wallets-work,E-Wallet Discussion,Hardware wallets are special types of Bitcoin wallets that make use of a secure hardware device to store a userвҖҷs private keys. They are physical devices that carry an encryption and its sole function is to store your wallet file. They are preferred to standard software wallets due to some reasons:,
Quora,https://www.quora.com/How-do-e-wallets-work,E-Wallet Discussion,2. Do not have to carry cash and easily shop online.,
Quora,https://www.quora.com/How-do-e-wallets-work,E-Wallet Discussion,"B.Tech in financial mgt. from Federal University of Technology, Owerri (FUTO) (Graduated 2020)Author has 470 answers and 1.8M answer views",
Quora,https://www.quora.com/How-do-e-wallets-work,E-Wallet Discussion,Certified Prompt Engineer at Agnidigitalservices (2024вҖ“present),
Quora,https://www.quora.com/How-do-e-wallets-work,E-Wallet Discussion,Bitcoin wallet addresses are public,
Quora,https://www.quora.com/How-do-e-wallets-work,E-Wallet Discussion,When you set up direct deposit with,
Quora,https://www.quora.com/How-do-e-wallets-work,E-Wallet Discussion,"are used interchangeably within the industry, particularly in the world of blockchain. Some experts make the distinction that e-wallets require money to be moved and loaded onto them prior to any transaction (online or offline), whereas digital wallets simply save the userвҖҷs card details for easy future transactions, with the money remaining in the userвҖҷs bank or card account.",
Quora,https://www.quora.com/How-do-e-wallets-work,E-Wallet Discussion,"A decentralized wallet means that the holder of the keys will be accorded access to the crypto wallet. It allows the holder to use the keys to send or receive cryptocurrency anywhere on the planet. Some people regard a decentralized wallet to be anonymous, but it is not. It is Pseudonymous.

Decentralized wallets allow pure peer-to-peer digital transactions: Skipping a regulatory body and transacting peer-to-peer is kind of like the digital equivalent of paying in cash. In other words, the transaction can be truly private. This type of transaction over the internet was impossible before the adve

Continue Reading",
Quora,https://www.quora.com/How-do-e-wallets-work,E-Wallet Discussion,can change the wallet usage. Same providers are enabling UPI payments and they work fantastic.,
Quora,https://www.quora.com/How-do-e-wallets-work,E-Wallet Discussion,BloggerAuthor has 553 answers and 566.9K answer views,
Quora,https://www.quora.com/How-do-e-wallets-work,E-Wallet Discussion,"In the background of the accounting ledger, there are managed bank accounts, which hold the actual money from customers (the ""view"" on this money from the perspective of a user is called ""eWallet""). ... Way to store credit cards, bank accounts and other payment instruments, so that the eWallet",
Quora,https://www.quora.com/How-do-e-wallets-work,E-Wallet Discussion,"Every year you don't comparison shop, you're probably donating $500-1,500 to your insurance company's profit margins.",
Quora,https://www.quora.com/How-do-e-wallets-work,E-Wallet Discussion,"Related
How does a multisig wallet work?",
Quora,https://www.quora.com/How-do-e-wallets-work,E-Wallet Discussion,How do decentralized cryptocurrency wallets work?,
Quora,https://www.quora.com/How-do-e-wallets-work,E-Wallet Discussion,"I am using Paytm. It is available everywhere in India also ease of payment. Many cashback offers are from Paytm e.g. 10 pe 100 (Payment to merchants).It also offers banking point on the app. The best part is paytm postpaid, pay hassle free, without money. Thank you Please help me to make my answers error free and suggest some new words.",
Quora,https://www.quora.com/How-do-e-wallets-work,E-Wallet Discussion,Think of a bitcoin wallet as a bank account number instead of a bill-fold style wallet. This address looks like,
Quora,https://www.quora.com/How-do-e-wallets-work,E-Wallet Discussion,"Your debit and credit cards are saved in wallet apps on your mobile device as part of a digital wallet. Apple PayВ®, Samsung Pay, and Google Pay are a few of these apps. Your card number and personal information are not saved (to assist in maintaining your security).",
Quora,https://www.quora.com/How-do-e-wallets-work,E-Wallet Discussion,"I have used almost all the major wallets that are prevalent in India. Over time, I have grown used to just a few. However, I change my usage preference based on the kind of transaction, the offers and the convenience it gives me. For example, a store that does not accept Paytm but accepts Phonepe wallet, I use PhonePe. In that case, Phonepe is best. Why? Because I was able to buy the product without an interruption. Paytm, Phonepe, Olamoney and others come with their own perks. I use them all and find them best when they allow me to complete a transaction successfully. On a side note, I believe that UPI payments can change the wallet usage. Same providers are enabling UPI payments and they work fantastic.",
Quora,https://www.quora.com/How-do-e-wallets-work,E-Wallet Discussion,"A cryptocurrency wallet is a piece of software that keeps track of the secret keys used to digitally sign cryptocurrency transactions for distributed ledgers. Because those keys are the only way to prove ownership of digital assets вҖ“ and to execute transactions that transfer them or change them in some way вҖ“ they are a critical piece of the cryptocurrency ecosystem.

Better known as ""crypto wallets,"" they are like the keys to the blockchain car. Without those keys, the car won't run. And without them, there would be no way to prove ownership of a digital asset - anything from a bitcoin to a toke

Continue Reading",
Quora,https://www.quora.com/How-do-e-wallets-work,E-Wallet Discussion,How do digital wallets work for cryptocurrency?,
Quora,https://www.quora.com/How-do-e-wallets-work,E-Wallet Discussion,"Suppose you have Rs1000/- in your ewallet from an issuer X. You can do transactions at various POS-terminals which accept this wallet. When you make your payment through the ewallet, the money without any hassle is moved to the transactor's account. There is no time required for clearance of money or whatsoever.",
Quora,https://www.quora.com/How-do-e-wallets-work,E-Wallet Discussion,getting a huge amount of customer data which is a costly asset now a days.,
Quora,https://www.quora.com/How-do-e-wallets-work,E-Wallet Discussion,"A Trust Wallet is a mobile cryptocurrency wallet that lets you store and manage various cryptocurrencies. It works by giving you a private key, which you use to access your funds. You can send, receive, and store crypto, and also interact with decentralized apps (dApps).",
Quora,https://www.quora.com/How-do-e-wallets-work,E-Wallet Discussion,) is a transformation in the way you pay for things.,
Quora,https://www.quora.com/How-do-e-wallets-work,E-Wallet Discussion,in payments industry since my early 20sAuthor has 302 answers and 800.2K answer views,
Quora,https://www.quora.com/How-do-e-wallets-work,E-Wallet Discussion,"Using a Bitcoin wallet doesnвҖҷt cost you anything if youвҖҷre just storing Bitcoin in the wallet. However, if youвҖҷre completing a transaction, then the owner of the exchange or device that is housing your wallet will charge you various fees depending on what youвҖҷre trying to do. Purchasing a wallet could cost you anywhere from $0 to $200 or more. If youвҖҷre using a wallet as part of an exchange then youвҖҷll likely pay either a flat fee of a few dollars or a percentage of the total transaction value.",
Quora,https://www.quora.com/How-do-e-wallets-work,E-Wallet Discussion,"Generally speaking, e-wallets can be used for shopping, booking plane tickets, school fees, and so on. It can do nearly anything that can be done using physical cash.",
Quora,https://www.quora.com/How-do-e-wallets-work,E-Wallet Discussion,"Many digital wallet services work through apps on your smartphone. At the supermarket, fo",
Quora,https://www.quora.com/How-do-e-wallets-work,E-Wallet Discussion,Author has 403 answers and 1.2M answer views,
Quora,https://www.quora.com/How-secure-are-digital-wallets,E-Wallet Discussion,"Promoted by The Penny Hoarder
What's your most unhinged advice to combat the insane cost of living?
Lisa Dawson
Personal Finance Writer at The Penny Hoarder (2010вҖ“present)
В В·В 
Updated Apr 15

LetвҖҷs be real вҖ” the usual advice about skipping lattes or canceling Netflix is a joke. The cost of living has gone feral, and a $6 coffee isnвҖҷt the reason most of us are broke.

If you actually want to survive right now, you need tricks that feel a little off the rails вҖ” like slashing bills you didnвҖҷt even know were ripping you off, or getting paid for stuff you already waste time on anyway. ItвҖҷs not glamorous, but it works. Here are the вҖңunhingedвҖқ money moves that actually make a dent.

1. Cancel Your Car Insurance

You might not even realize it, but your car insurance company is probably overcharg

Continue Reading
Upvote
10.9K
2.9K
190",
Quora,https://www.quora.com/How-secure-are-digital-wallets,E-Wallet Discussion,Author has 56 answers and 48.2K answer views,
Quora,https://www.quora.com/How-secure-are-digital-wallets,E-Wallet Discussion,"The answer to how safe crypto actually is, at least for now, is complicated. Yes, cryptocurrency does come with some security risks that you should know about before making your first trade. Firstly, crypto is still an extremely volatile",
Quora,https://www.quora.com/How-secure-are-digital-wallets,E-Wallet Discussion,. Knowing thereвҖҷs such a substantial safety net in place gives me peace of mind.,
Quora,https://www.quora.com/How-secure-are-digital-wallets,E-Wallet Discussion,"Way to store credit cards, bank accounts and other payment instruments, so that the eWallet can be funded easily later",
Quora,https://www.quora.com/How-secure-are-digital-wallets,E-Wallet Discussion,I have experience with a lot of coins,
Quora,https://www.quora.com/How-secure-are-digital-wallets,E-Wallet Discussion,", you can get high-speed, 5G home internet for as little as $35 a month.",
Quora,https://www.quora.com/How-secure-are-digital-wallets,E-Wallet Discussion,How secure are digital currencies?,
Quora,https://www.quora.com/How-secure-are-digital-wallets,E-Wallet Discussion,"If you suspect theyвҖҷre messaging someone they met online, you can also see if they have secret social profiles. рҹ‘ү FIND HIDDEN SOCIAL PROFILES. Just enter their name, email, or phone number, and you can see if theyвҖҷre connected to secret Instagram, Facebook, or Snapchat accounts.",
Quora,https://www.quora.com/How-secure-are-digital-wallets,E-Wallet Discussion,Author has 2.3K answers and 2.4M answer views,
Quora,https://www.quora.com/How-secure-are-digital-wallets,E-Wallet Discussion,We need to encourage competition between authentication services to ensure that the companies that provide these services are always working to improve the security of their products.,
Quora,https://www.quora.com/How-secure-are-digital-wallets,E-Wallet Discussion,Originally Answered: How are digital wallets secured?,
Quora,https://www.quora.com/How-secure-are-digital-wallets,E-Wallet Discussion,"A closed wallet is issued by a company to a consumer for buying goods and services exclusively from that company. E.g. Flipkart, Oyo rooms, Ola(Now they are upgraded to Semi Closed) are some of the examples of the companies using closed wallets.",
Quora,https://www.quora.com/How-secure-are-digital-wallets,E-Wallet Discussion,"Related
Which is the best crypto digital wallet?",
Quora,https://www.quora.com/How-secure-are-digital-wallets,E-Wallet Discussion,"The Real Game-Changer Tools like ComparisonAdviser absolutely terrify insurance companies because they eliminate our biggest advantage: information asymmetry. When customers can instantly see what competitors charge with identical coverage and discounts applied, our whole ""loyalty tax"" model collapses.",
Quora,https://www.quora.com/How-secure-are-digital-wallets,E-Wallet Discussion,"(Member FDIC), theyвҖҷll put up to $400 straight into your account. NoвҖҰ really. Just a nice little bonus for making a smart switch.",
Quora,https://www.quora.com/How-secure-are-digital-wallets,E-Wallet Discussion,"Lockly founder and chief executive Lee Zheng says the brandвҖҷs designs feature more than 30 global patent technologies. вҖңAll locks are equipped with the worldвҖҷs first patented peek-proof keypad powered by an advanced algorithm activated by four buttons, each containing a set of three numbers that randomly reshuffle after each use,вҖқ he said. вҖңThis offers the highest level of privacy, security, and convenience by preventing your access code from being revealed, spied upon or stolen.вҖқ",
Quora,https://www.quora.com/How-secure-are-digital-wallets,E-Wallet Discussion,"Hey, a digital wallet is a software-based system that securely stores users' payment information and passwords for numerous payment methods and websites. By using a digital wallet, users can complete purchases easily and quickly with near-field communications technology. They can also create stronger passwords without worrying about whether they will be able to remember them later. Digital wallets can be used in conjunction with mobile payment systems, which allow customers to pay for purchases with their smartphones. A digital wallet can also be used to store loyalty card information and digital coupons. Digital wallets largely eliminate the need to carry a physical wallet by storing all of a consumer's payment information securely and compactly. Also, digital wallets are a potential boon to companies that collect consumer data. The more companies know about their customers' purchasing habits, the more effectively they can market to them. The downside for consumers can be a loss of privacy. Digital wallets allow many in developing nations to participate more fully in th...",
Quora,https://www.quora.com/How-secure-are-digital-wallets,E-Wallet Discussion,"Related
What is a 'digital wallet'?",
Quora,https://www.quora.com/How-secure-are-digital-wallets,E-Wallet Discussion,How to facilitate this service to such a large no. of customers and merchants especially under privileged ones?,
Quora,https://www.quora.com/How-secure-are-digital-wallets,E-Wallet Discussion,"This issue should concern those advancement foundations, organizations, and legislatures investigating blockchain for the more proficient conveyance of help, cash settlements, shrewd agreements, wellbeing administrations, and then some. Similarly, social business visionaries should pose similar inquiries as they seek after the potential for less expensive worldwide installments, more clear property freedoms, and more extensive admittance to fund.",
Quora,https://www.quora.com/How-secure-are-digital-wallets,E-Wallet Discussion,Anything that is вҖңregulatedвҖқ by the SEC can be seized by any,
Quora,https://www.quora.com/How-secure-are-digital-wallets,E-Wallet Discussion,"A digital wallet is safer than storing your coins on an exchange or trading platform.

While a trusted exchange is relatively вҖңsafeвҖқ to store coins, risks are higher that in the event the platform has some troubles your coins will become unavailable.

Digital wallets like:

Online wallets
Desktop wallets
Smartphone wallets

Are increasing in safety. As soon as you own the private keys to your wallet your are relatively safeвҖҰ unless the private keys are stored on the same computer. Hackers, in such instances, might get to your coins stillвҖҰ although the chances are relatively low.

The safest wallets are ha

Continue Reading",
Quora,https://www.quora.com/How-secure-are-digital-wallets,E-Wallet Discussion,If i simply try to answer your question in yes/no вҖҰi will say YES but,
Quora,https://www.quora.com/How-secure-are-digital-wallets,E-Wallet Discussion,"Every month, I'd get a report of customers who hadn't shopped around in 2+ years. These were our golden geese - we could raise their rates aggressively because they'd proven they wouldn't leave. One customer I remember was paying $3,200 annually for coverage that should have cost $1,800. She stayed for 5 years.",
Quora,https://www.quora.com/How-secure-are-digital-wallets,E-Wallet Discussion,"The key used to encrypt your information is generated from your password. eWallet does not store your password in your wallet file, or anywhere on your mobile device or your Mac or PC (with one possible exception, if the user chooses to use a convenience technology such as Apple's Touch ID with eWallet, then the password could be stored in a secure area protected by the device's secure enclave).",
Quora,https://www.quora.com/How-secure-are-digital-wallets,E-Wallet Discussion,"trailing bitcoin from 5 years , 3 year other cryptos.",
Quora,https://www.quora.com/How-secure-are-digital-wallets,E-Wallet Discussion,"Related
How secure are cryptocurrency exchanges and wallets against digital theft?",
Quora,https://www.quora.com/How-secure-are-digital-wallets,E-Wallet Discussion,"Digital wallet as the name resembles, is the digitized version of traditional leather wallet, to safe keep your money, credit cards, etc. It is basically a modification in the way you pay for things,  a more safer and secured way. So, how does this work? Digital wallets mostly work through apps with your smartphone. The communication channel might differ from NFC, WEBLINKS, QR-code, SMS, Social Media, etc. but the overall concept of wallet will remain same. To better understand the working of wallets, you first need to look towards how wallets are differentiated. Digital wallets are categorized into three kinds:Closed Wallet: A closed wallet is issued by a company to a consumer for buying goods and services exclusively from that company. E.g. Flipkart, Oyo rooms, Ola(Now they are upgraded to Semi Closed) are some of the examples of the companies using closed wallets.Semi-Closed Wallet: A semi-closed wallet can be used to buy goods and services, including financial services, at clearly identified merchant locations or establishments, which have a specific contract with the issuer to accept the payment instruments, but this still do not permit cash withdrawal or redemption by holder. Eg. Paytm, PayU, EKO, etc have PPI(to know more about PPI - Prepaid Payment Instruments in India) license for opening and using Semi Closed wallets.Open Wallet: Open wallets can be used for purchase of goods and services including financial services. It can also be used for funds transfer or POS terminals that accepts cards and also for cash withdrawal from ATM. Eg. MasterCard, VISA, RuPay, etc provide open wallet services to issuers(Banks).So, now the treatment of the money in the wallet is dependent on the type of the wallet, the consumer is using.",
Quora,https://www.quora.com/How-secure-are-digital-wallets,E-Wallet Discussion,"ItвҖҷs a legitimate question, given the recent spike in cryptocurrency trading and governmentsвҖҷ struggles to keep up with consistent regulation. CryptocurrencyвҖҷs securityвҖ”or lack thereofвҖ”will likely continue to be a more pressing issue in the years ahead, as a recent report from Allied Market Research projects the global crypto market to more than triple by 2030.

The answer to how safe crypto actually is, at least for now, is complicated. Yes, cryptocurrency does come with some security risks that you should know about before making your first trade. Firstly, crypto is still an extremely volatile

Continue Reading",
Quora,https://www.quora.com/How-secure-are-digital-wallets,E-Wallet Discussion,Author has 1.2K answers and 728.8K answer views,
Quora,https://www.quora.com/How-secure-are-digital-wallets,E-Wallet Discussion,Coinbase is the most trusted Wallet rightnow with the highest number of users. You should use only trusted currency exchanges to take money out of your wallets. For Indian citizens Binance and Wazirx are the best options. Still Binance is globally the most trusted wallet so prefer Binance over all of the others.,
Quora,https://www.quora.com/How-secure-are-digital-wallets,E-Wallet Discussion,"So, how does this work?
Digital wallets mostly work through apps with your smartphone. The communication channel might differ from NFC, WEBLINKS, QR-code, SMS, Social Media, etc. but the overall concept of wallet will remain same. To better understand the working of wallets, you first need to look towards how wallets are differentiated.",
Quora,https://www.quora.com/How-secure-are-digital-wallets,E-Wallet Discussion,DonвҖҷt waste your time browsing insurance sites for a better deal. A company called,
Quora,https://www.quora.com/How-secure-are-digital-wallets,E-Wallet Discussion,Which digital wallet in India is the most secure?,
Quora,https://www.quora.com/How-secure-are-digital-wallets,E-Wallet Discussion,"wallet. I have personally been using it since 2015 and never had a real issue with them. I have 2fa activated and my transactions have been secured so far. However, there are some people who had money stolen from them and complained about it online, so I do not know what to say about their experience.",
Quora,https://www.quora.com/How-secure-are-digital-wallets,E-Wallet Discussion,"*This is a paid advertisement. Carefully consider the investment objectives, risks, charges and expenses of the Fundrise Flagship Fund before investing. This and other information can be found in the FundвҖҷs prospectus. Read them carefully before investing.",
Quora,https://www.quora.com/How-secure-are-digital-wallets,E-Wallet Discussion,"Investment Advisor/ Entrepreneur/Crypto head, tourist",
Quora,https://www.quora.com/How-secure-are-digital-wallets,E-Wallet Discussion,"If theyвҖҷre messaging someone they met online, they might also have hidden dating profiles. рҹ‘ү UNCOVER DATING PROFILES. This tool can show you if theyвҖҷre active on Tinder, Bumble, Hinge, or other apps.",
Quora,https://www.quora.com/How-secure-are-digital-wallets,E-Wallet Discussion,that Metamask does not support.,
Quora,https://www.quora.com/How-secure-are-digital-wallets,E-Wallet Discussion,The answer to this depends on how the user manages the wallet. Every wallet contains a set of private keys without which the bitcoin owner cannot access the currency. The biggest danger in bitcoin security is the individual user perhaps losing the private key or having the private key stolen.,
Quora,https://www.quora.com/How-secure-are-digital-wallets,E-Wallet Discussion,"If you tell them a bit about yourself and your vehicle, theyвҖҷll send you personalized quotes so you can compare them and find the best one for you. No phone calls. No spam. Just happy customers (4.7 rating on Trustpilot).",
Quora,https://www.quora.com/How-secure-are-digital-wallets,E-Wallet Discussion,Check for Hidden Social Media Profiles,
Quora,https://www.quora.com/How-secure-are-digital-wallets,E-Wallet Discussion,Studied Aerospace Systems Engineering at University of Hertfordshire (Graduated 2021),
Quora,https://www.quora.com/How-secure-are-digital-wallets,E-Wallet Discussion,", and multi-factor authentication. However,",
Quora,https://www.quora.com/How-secure-are-digital-wallets,E-Wallet Discussion,"Security is a major issue concerning digital wallets. A digital wallet hosts our identity, digital assets, certifications, health data and so many other types of information. This information is sensitive and valuable to us. It is important that we are the only ones who have access to it and we have methods to ensure that if we lose access to a device we will not lose all our information. The same broad security concerns about the wallet in our pocket apply to a digital wallet. We don't want to lose it. We don't want it to fall into the wrong person's hands. The advantage of a digital wallet over a physical wallet is that we don not lose the keys that protect our security if our phone falls into the wrong person's hands. If someone gets our physical wallet, they can abuse our credit cards, identifications and cash. With a digital wallet, it is locked and we are the key.",
Quora,https://www.quora.com/How-secure-are-digital-wallets,E-Wallet Discussion,A digital wallet is safer than storing your coins on an exchange or trading platform.,
Quora,https://www.quora.com/How-secure-are-digital-wallets,E-Wallet Discussion,Online wallets I wouldnвҖҷt trust.,
Quora,https://www.quora.com/How-secure-are-digital-wallets,E-Wallet Discussion,Crypto and blockchain educatorAuthor has 1.2K answers and 728.8K answer views,
Quora,https://www.quora.com/How-secure-are-digital-wallets,E-Wallet Discussion,The Cryptocurrency Investing Standard explains all the wallets and their safety. It equips you with wallets that rule out loss of funds.,
Quora,https://www.quora.com/How-secure-are-digital-wallets,E-Wallet Discussion,"Related
How Secure are digital locks?",
Quora,https://www.quora.com/How-secure-are-digital-wallets,E-Wallet Discussion,Director Of Investment/Strategic Partnerships at Binance (2021вҖ“present),
