п»ҝsource,url,app_name,content,score
Quora,https://www.quora.com/How-do-e-wallets-work,E-Wallet Discussion,Requires one or more copayers to sign a transaction to send funds from the wallet. This feature adds security to your funds.,
Quora,https://www.quora.com/How-do-e-wallets-work,E-Wallet Discussion,"The security of your PDA or PDA is dependent upon the settings you use. If you donвҖҷt have your device guaranteed with some sort of mystery word, by then someone could take your contraption and perhaps access the resources in your monetary equilibrium or Visas. There are positive security inclinations to consider which make an e-wallet a significant advancement, anyway it requires the able organization of it to intensify them.",
Quora,https://www.quora.com/How-do-e-wallets-work,E-Wallet Discussion,"Related
What are some common electronic transactions that we generally make on digital wallets or e-wallets?",
Quora,https://www.quora.com/How-do-e-wallets-work,E-Wallet Discussion,"Hey, An Electronic wallet, in some cases, called an вҖңadvanced walletвҖқ or вҖңe-walletвҖқ, is an electronic rendition of an installment card that is approved to lead exchanges for your sake. These wallets are normally on a cell phone, for example, a cell phone, however, work areas and PCs can hold an electronic also.

Electronic wallets should be connected to explicit charge or MasterCard to work appropriately. There might be a prerequisite to connecting the e-wallet to a financial balance also. At that point, using data and programming, buyers can utilize their electronic wallet to pay for things as

Continue Reading",
Quora,https://www.quora.com/How-do-e-wallets-work,E-Wallet Discussion,"Way to store credit cards, bank accounts and other payment instruments, so that the eWallet can be funded easily later",
Quora,https://www.quora.com/How-do-e-wallets-work,E-Wallet Discussion,"Can you explain the process of ""Loading"" and ""Unloading"" money in the eвӮ№ wallet?",
Quora,https://www.quora.com/How-do-e-wallets-work,E-Wallet Discussion,Know more about digital wallets here.,
Quora,https://www.quora.com/How-do-e-wallets-work,E-Wallet Discussion,A 2-3 wallet requires two copayers to sign a transaction (out of three copayers total). Copayer A creates the transaction proposal. Either of the remaining copayers (Copayer B or Copayer C) can approve the transaction proposal. A 2-3 wallet has three copayers but requires only two signatures.,
Quora,https://www.quora.com/How-do-e-wallets-work,E-Wallet Discussion,managed by a bank or a company.,
Quora,https://www.quora.com/How-do-e-wallets-work,E-Wallet Discussion,"Additionally, BKM Express is one of a number of E-wallet payment methods that Payssion has bundled together for its clients on one integration. I believe it can introduce global enterprises and local users with a simple, secure, and convenient payment experience in Turkey. For further details, just drop them a line to discover more features.",
Quora,https://www.quora.com/How-do-e-wallets-work,E-Wallet Discussion,Blockchain EntrepreneurAuthor has 198 answers and 181.4K answer views,
Quora,https://www.quora.com/How-do-e-wallets-work,E-Wallet Discussion,"for E.g,. Rs 10 might be a small amount",
Quora,https://www.quora.com/How-do-e-wallets-work,E-Wallet Discussion,"A closed wallet is issued by a company to a consumer for buying goods and services exclusively from that company. E.g. Flipkart, Oyo rooms, Ola(Now they are upgraded to Semi Closed) are some of the examples of the companies using closed wallets.",
Quora,https://www.quora.com/How-do-e-wallets-work,E-Wallet Discussion,"What is the difference between an e-wallet and a mobile wallet? What are they used for, respectively?",
Quora,https://www.quora.com/How-do-e-wallets-work,E-Wallet Discussion,"The Real Game-Changer Tools like ComparisonAdviser absolutely terrify insurance companies because they eliminate our biggest advantage: information asymmetry. When customers can instantly see what competitors charge with identical coverage and discounts applied, our whole ""loyalty tax"" model collapses.",
Quora,https://www.quora.com/How-do-e-wallets-work,E-Wallet Discussion,"Like me, I am using STICPAY and NETELLER for my trading account and these is for me the most convenient E-wallets I have ever used for my trading.",
Quora,https://www.quora.com/How-do-e-wallets-work,E-Wallet Discussion,Author has 196 answers and 14.2K answer views,
Quora,https://www.quora.com/How-do-e-wallets-work,E-Wallet Discussion,"(Member FDIC), theyвҖҷll put up to $400 straight into your account. NoвҖҰ really. Just a nice little bonus for making a smart switch.",
Quora,https://www.quora.com/How-do-e-wallets-work,E-Wallet Discussion,Originally Answered: How do cryptocurrency wallets work?,
Quora,https://www.quora.com/How-do-e-wallets-work,E-Wallet Discussion,"The terms вҖҳe-walletвҖҷ and вҖҳdigital walletвҖҷ are used interchangeably within the industry, particularly in the world of blockchain. Some experts make the distinction that e-wallets require money to be moved and loaded onto them prior to any transaction (online or offline), whereas digital wallets simply save the userвҖҷs card details for easy f",
Quora,https://www.quora.com/How-do-e-wallets-work,E-Wallet Discussion,"Cryptocurrency wallets are tools that store private keys, allowing users to access, send, and receive digital assets on a blockchain. In practice, they do not store the coins themselves but enable secure interaction with the network by signing and verifying transactions.",
Quora,https://www.quora.com/How-do-e-wallets-work,E-Wallet Discussion,All the copayers can see the funds and transactions of the wallet.,
Quora,https://www.quora.com/How-do-e-wallets-work,E-Wallet Discussion,"A crypto paper wallet works like any other crypto wallet, but you would print it out on paper. So, once you know which crypto you want to store (do your research as with everything) you can use a wallet generator to produce a paper wallet. All the keys you need will then be stored on that wallet, you print it and keep it in a safe place. The downside of this is that anything can happen to paperвҖҰ It could get wet, or if you have a fireвҖҰitвҖҷs gone. But of course you could print out several copies and keep them safe, or alternatively store them on a USB stick that you keep offline until you need it, or on a computer thatвҖҷs not online. If you follow a few simple steps to keep your keys safe, the paper wallet is one of the safest ways to store crypto. I hope this helps.",
Quora,https://www.quora.com/How-do-e-wallets-work,E-Wallet Discussion,"A mobile wallet, or m-wallet, is an electronic wallet that allows you to save your credit card information and make payments using your smartphone. m-Wallets, in other words, are used to make mobile payments. Apple Pay, Google Pay, and Samsung Pay are examples of popular",
Quora,https://www.quora.com/How-do-e-wallets-work,E-Wallet Discussion,"Electronic wallets have gotten comprehensively recognized in the past couple of years. Most territories that recognize cards as a portion elective will allow you to pay with your electronic wallet. Disregarding the way that there are as yet a couple of regions that are using more settled getting ready progressions, which confines something or organization access, the number of retailers who give portion access in this manner continues extending each year.",
Quora,https://www.quora.com/How-do-e-wallets-work,E-Wallet Discussion,"Digital wallets are important for many reasons besides increasing the comfort level of the users and allowing payments at their fingertips. Some of these reasons are as follows.

The payment information and history stay in the digital wallets in a very compact form. Also, they reduce the need for traditional physical wallets and the hassle of carrying them.
The use of digital wallets by customers largely helps them in finding the products and services of their interest online. This happens by the collection of data regarding consumer preferences by the companies.
Companies get a better view of the
Continue Reading",
Quora,https://www.quora.com/How-do-e-wallets-work,E-Wallet Discussion,"Your private keys give you access and control over those assets on blockchain. The wallet simply helps you see which coins you have access to, and helps you create, sign and broadcast transactions.",
Quora,https://www.quora.com/How-do-e-wallets-work,E-Wallet Discussion,for example go back to 4 years ago if we need to book a movie ticket we need to o to theater to get the ticket or we need to pay through out bank cards or net banking.,
Quora,https://www.quora.com/How-do-e-wallets-work,E-Wallet Discussion,It may offer permission for new rewards вҖ“,
Quora,https://www.quora.com/How-do-e-wallets-work,E-Wallet Discussion,"Every month, I'd get a report of customers who hadn't shopped around in 2+ years. These were our golden geese - we could raise their rates aggressively because they'd proven they wouldn't leave. One customer I remember was paying $3,200 annually for coverage that should have cost $1,800. She stayed for 5 years.",
Quora,https://www.quora.com/How-do-e-wallets-work,E-Wallet Discussion,"Countless electronic wallets that offer a prizes program will charge you a cost to move those prizes. You may be expected to deal with portions considering a specific objective to get to these favorable circumstances moreover. While using the PayPal charge program, for example, customers get 1% cashback when their trade is a standard imprint credit trade. Using a PIN through modernized wallet exploits since youвҖҷre changing how the retail store treats the trade. In case you consume $900 consistently, youвҖҷd lose over $100 consistently for the convenience of this portion method.",
Quora,https://www.quora.com/How-do-e-wallets-work,E-Wallet Discussion,Some good existing answers so IвҖҷll try to provide a different perspective.,
Quora,https://www.quora.com/How-do-e-wallets-work,E-Wallet Discussion,"And honestly? Putting them to use was way easier than I had expected. I bet you can knock out at least three or four of these right nowвҖ”yes, even from your phone. DonвҖҷt wait like I did.",
Quora,https://www.quora.com/How-do-e-wallets-work,E-Wallet Discussion,"If you follow a few simple steps to keep your keys safe, the paper wallet is one of the safest ways to store crypto.",
Quora,https://www.quora.com/How-do-e-wallets-work,E-Wallet Discussion,"Before we go any further, understand that the term digital wallet is a blanket descriptor for a range of technologies that let you perform many tasks. In general, though, a",
Quora,https://www.quora.com/How-do-e-wallets-work,E-Wallet Discussion,It could engage in stupid spending вҖ“,
Quora,https://www.quora.com/How-do-e-wallets-work,E-Wallet Discussion,"The main point, you do not know on what address on blockchain are your coins, there are simply too many possibilities to guess the address.",
Quora,https://www.quora.com/How-do-e-wallets-work,E-Wallet Discussion,"Digital wallet as the name resembles, is the digitized version of traditional leather wallet, to safe keep your money, credit cards, etc. It is basically a modification in the way you pay for things,  a more safer and secured way. So, how does this work? Digital wallets mostly work through apps with your smartphone. The communication channel might differ from NFC, WEBLINKS, QR-code, SMS, Social Media, etc. but the overall concept of wallet will remain same. To better understand the working of wallets, you first need to look towards how wallets are differentiated. Digital wallets are categorized into three kinds:Closed Wallet: A closed wallet is issued by a company to a consumer for buying goods and services exclusively from that company. E.g. Flipkart, Oyo rooms, Ola(Now they are upgraded to Semi Closed) are some of the examples of the companies using closed wallets.Semi-Closed Wallet: A semi-closed wallet can be used to buy goods and services, including financial services, at clearly identified merchant locations or establishments, which have a specific contract with the issuer to accept the payment instruments, but this still do not permit cash withdrawal or redemption by holder. Eg. Paytm, PayU, EKO, etc have PPI(to know more about PPI - Prepaid Payment Instruments in India) license for opening and using Semi Closed wallets.Open Wallet: Open wallets can be used for purchase of goods and services including financial services. It can also be used for funds transfer or POS terminals that accepts cards and also for cash withdrawal from ATM. Eg. MasterCard, VISA, RuPay, etc provide open wallet services to issuers(Banks).So, now the treatment of the money in the wallet is dependent on the type of the wallet, the consumer is using.",
Quora,https://www.quora.com/How-do-e-wallets-work,E-Wallet Discussion,"To move funds, every wallet requires the user broadcasting the payment to sign the transaction. Multisig wallets also require one or more copayers to sign the transaction.",
Quora,https://www.quora.com/How-do-e-wallets-work,E-Wallet Discussion,now most of the people are paying through E-wallets because of cash backs and free popcorn.,
Quora,https://www.quora.com/How-do-e-wallets-work,E-Wallet Discussion,"So, once you know which crypto you want to store (do your research as with everything) you can use a wallet generator to produce a paper wallet.",
Quora,https://www.quora.com/How-do-e-wallets-work,E-Wallet Discussion,"So, how does this work?
Digital wallets mostly work through apps with your smartphone. The communication channel might differ from NFC, WEBLINKS, QR-code, SMS, Social Media, etc. but the overall concept of wallet will remain same. To better understand the working of wallets, you first need to look towards how wallets are differentiated.",
Quora,https://www.quora.com/How-do-e-wallets-work,E-Wallet Discussion,"КҖМІбҙҮМІбҙ„МІбҙҸМІбҙ МІбҙҮМІКҖМІЙӘМІЙҙМІЙўМІ МІТ“МІбҙңМІЙҙМІбҙ…МІsМІ МІКҹМІбҙҸМІsМІбҙӣМІ МІбҙӣМІбҙҸМІ МІбҙ„МІКҖМІКҸМІбҙҳМІбҙӣМІбҙҸМІбҙ„МІбҙңМІКҖМІКҖМІбҙҮМІЙҙМІбҙ„МІКҸМІ МІТ“МІКҖМІбҙҖМІбҙңМІбҙ…МІ МІЙӘМІsМІ МІбҙңМІЙҙМІбҙ…МІбҙҸМІбҙңМІКҷМІбҙӣМІбҙҮМІбҙ…МІКҹМІКҸМІ МІбҙ„МІКңМІбҙҖМІКҹМІКҹМІбҙҮМІЙҙМІЙўМІЙӘМІЙҙМІЙўМІ,МІ МІКҷМІбҙңМІбҙӣМІ МІбҙҳМІбҙҸМІsМІsМІЙӘМІКҷМІКҹМІбҙҮМІ МІбҙҸМІбҙңМІбҙӣМІбҙ„МІбҙҸМІбҙҚМІбҙҮМІsМІ МІбҙ„МІбҙҖМІЙҙМІ МІsМІбҙӣМІЙӘМІКҹМІКҹМІ МІКҷМІбҙҮМІ МІбҙҖМІбҙ„МІКңМІЙӘМІбҙҮМІбҙ МІбҙҮМІбҙ…МІ МІбҙңМІЙҙМІбҙ…МІбҙҮМІКҖМІ МІбҙӣМІКңМІбҙҮМІ МІКҖМІЙӘМІЙўМІКңМІбҙӣМІ МІбҙ„МІЙӘМІКҖМІбҙ„МІбҙңМІбҙҚМІsМІбҙӣМІбҙҖМІЙҙМІбҙ„МІбҙҮМІsМІ.МІ МІsМІбҙӣМІбҙҖМІКҸМІЙӘМІЙҙМІЙўМІ МІбҙҖМІКҹМІбҙҮМІКҖМІбҙӣМІ,МІ МІбҙ„МІбҙҖМІКҹМІбҙҚМІ,МІ МІбҙҖМІЙҙМІбҙ…МІ МІбҙҚМІбҙҮМІЙҙМІбҙӣМІбҙҖМІКҹМІКҹМІКҸМІ МІТ“МІбҙҸМІбҙ„МІбҙңМІsМІбҙҮМІбҙ…МІ МІбҙӣМІКңМІКҖМІбҙҸМІбҙңМІЙўМІКңМІбҙҸМІбҙңМІбҙӣМІ МІбҙӣМІКңМІбҙҮМІ МІбҙҳМІКҖМІбҙҸМІбҙ„МІбҙҮМІsМІsМІ МІбҙҳМІКҹМІбҙҖМІКҸМІsМІ МІбҙҖМІ МІбҙ„МІКҖМІбҙңМІбҙ„МІЙӘМІбҙҖМІКҹМІ МІКҖМІбҙҸМІКҹМІбҙҮМІ МІЙӘМІЙҙМІ МІбҙҚМІбҙҖМІбҙӢМІЙӘМІЙҙМІЙўМІ МІsМІбҙҸМІбҙңМІЙҙМІбҙ…МІ МІбҙ…МІбҙҮМІбҙ„МІЙӘМІsМІЙӘМІбҙҸМІЙҙМІsМІ МІбҙҖМІЙҙМІбҙ…МІ МІКҖМІбҙҮМІбҙ…МІбҙңМІбҙ„МІЙӘМІЙҙМІЙўМІ МІбҙӣМІКңМІбҙҮМІ МІКҖМІЙӘМІsМІбҙӢМІ МІбҙҸМІТ“МІ МІТ“МІбҙңМІКҖМІбҙӣМІКңМІбҙҮМІКҖМІ МІбҙҚМІбҙҖМІЙҙМІЙӘМІбҙҳМІбҙңМІКҹМІбҙҖМІбҙӣМІЙӘМІбҙҸМІЙҙМІ.МІ МІбҙ„МІбҙҸМІЙҙМІбҙӣМІЙӘМІЙҙМІбҙңМІбҙҸМІбҙңМІsМІ МІКҹМІбҙҮМІбҙҖМІКҖМІЙҙМІЙӘМІЙҙМІЙўМІ МІбҙҖМІЙҙМІбҙ…МІ МІбҙҖМІбҙЎМІбҙҖМІКҖМІбҙҮМІЙҙМІбҙҮМІsМІsМІ МІКңМІбҙҮМІКҹМІбҙҳМІsМІ МІsМІКңМІбҙҖМІКҖМІбҙҳМІбҙҮМІЙҙМІ МІбҙҠМІбҙңМІбҙ…МІЙўМІбҙҮМІбҙҚМІбҙҮМІЙҙМІбҙӣМІ МІбҙҖМІЙҙМІбҙ…МІ МІбҙҮМІЙҙМІбҙҖМІКҷМІКҹМІбҙҮМІsМІ МІЙӘМІЙҙМІбҙ…МІЙӘМІбҙ МІЙӘМІбҙ…МІбҙңМІбҙҖМІКҹМІsМІ МІбҙӣМІбҙҸМІ МІКҖМІбҙҮМІбҙ„МІбҙҸМІЙўМІЙҙМІЙӘМІбҙўМІбҙҮМІ МІКҖМІбҙҮМІбҙ…МІ МІТ“МІКҹМІбҙҖМІЙўМІsМІ МІбҙҚМІбҙҸМІКҖМІбҙҮМІ МІЗ«МІбҙңМІЙӘМІбҙ„МІбҙӢМІКҹМІКҸМІ МІЙӘМІЙҙМІ МІбҙӣМІКңМІбҙҮМІ МІТ“МІбҙңМІбҙӣМІбҙңМІКҖМІбҙҮМІ.МІ МІsМІбҙңМІбҙҳМІбҙҳМІбҙҸМІКҖМІбҙӣМІ МІЙҙМІбҙҮМІбҙӣМІбҙЎМІбҙҸМІКҖМІбҙӢМІsМІвҖ”МІбҙЎМІКңМІбҙҮМІбҙӣМІКңМІбҙҮМІКҖМІ МІбҙҳМІКҖМІбҙҸМІТ“МІбҙҮМІsМІsМІЙӘМІбҙҸМІЙҙМІбҙҖМІКҹМІ МІбҙҸМІКҖМІ МІбҙ„МІбҙҸМІбҙҚМІбҙҚМІбҙңМІЙҙМІЙӘМІбҙӣМІКҸМІ-МІКҷМІбҙҖМІsМІбҙҮМІбҙ…МІвҖ”МІбҙҖМІКҖМІбҙҮМІ МІбҙҮМІsМІsМІбҙҮМІЙҙМІбҙӣМІЙӘМІбҙҖМІКҹМІ МІЙӘМІЙҙМІ МІбҙҳМІКҖМІбҙҸМІбҙ МІЙӘМІбҙ…МІЙӘМІЙҙМІЙўМІ МІбҙҮМІбҙҚМІбҙҸМІбҙӣМІЙӘМІбҙҸМІЙҙМІбҙҖМІКҹМІ МІsМІбҙӣМІКҖМІбҙҮМІЙҙМІЙўМІбҙӣМІКңМІ МІбҙҖМІЙҙМІбҙ…МІ МІКңМІбҙҮМІКҹМІбҙҳМІЙӘМІЙҙМІЙўМІ МІбҙ МІЙӘМІбҙ„МІбҙӣМІЙӘМІбҙҚМІsМІ МІКҖМІбҙҮМІбҙҚМІбҙҖМІЙӘМІЙҙМІ МІЙўМІКҖМІбҙҸМІбҙңМІЙҙМІбҙ…МІбҙҮМІбҙ…МІ МІбҙӣМІКңМІКҖМІбҙҸМІбҙңМІЙўМІКңМІ МІКҹМІбҙҸМІЙҙМІЙўМІ МІКҖМІбҙҮМІбҙ„МІбҙҸМІбҙ МІбҙҮМІКҖМІКҸМІ МІбҙҳМІКҖМІбҙҸМІбҙ„МІбҙҮМІsМІsМІбҙҮМІsМІ.МІ",
Quora,https://www.quora.com/How-do-e-wallets-work,E-Wallet Discussion,"This is a paid advertisement. Carefully consider the investment objectives, risks, charges and expenses of the Fundrise Real Estate Fund before investing. This and other information can be found in the FundвҖҷs prospectus. Read them carefully before investing.",
Quora,https://www.quora.com/How-do-e-wallets-work,E-Wallet Discussion,DonвҖҷt waste your time browsing insurance sites for a better deal. A company called,
Quora,https://www.quora.com/How-do-e-wallets-work,E-Wallet Discussion,"An e-wallet is a prepaid online account, accessed via a mobile app or a desktop, which allows a user (an individual or company) to deposit and store money (which then becomes e-money) for any future online transaction, with the option of later withdrawing it.

The terms вҖҳe-walletвҖҷ and вҖҳdigital walletвҖҷ are used interchangeably within the industry, particularly in the world of blockchain. Some experts make the distinction that e-wallets require money to be moved and loaded onto them prior to any transaction (online or offline), whereas digital wallets simply save the userвҖҷs card details for easy f

Continue Reading",
Quora,https://www.quora.com/How-do-e-wallets-work,E-Wallet Discussion,18P6kVSoMxu8xmQ2CjTgRnGTZxsEw8ndvm,
Quora,https://www.quora.com/How-do-e-wallets-work,E-Wallet Discussion,"Related
Can e-wallets be used for both online and in-person transactions?",
Quora,https://www.quora.com/How-do-e-wallets-work,E-Wallet Discussion,It anticipates that customers should endorse each trade вҖ“,
Quora,https://www.quora.com/How-do-e-wallets-work,E-Wallet Discussion,5. Get Paid $225/Month While Watching Movie Previews,
Quora,https://www.quora.com/How-do-e-wallets-work,E-Wallet Discussion,How does a crypto paper wallet work?,
Quora,https://www.quora.com/How-do-e-wallets-work,E-Wallet Discussion,"So what a wallet or an exchange does - it stores information, on which address of all addresses on blockchain is your money/coins.",
Quora,https://www.quora.com/How-do-e-wallets-work,E-Wallet Discussion,Relationship Manager (2018вҖ“present),
Quora,https://www.quora.com/How-do-e-wallets-work,E-Wallet Discussion,Everything in this world has its cons and pros. E-wallet development services are enhancing their services with time. There are some major advantages and disadvantages of using an e-wallet in 2022.,
Quora,https://www.quora.com/How-do-e-wallets-work,E-Wallet Discussion,"is an e-wallet; an online service that can be used to make payments, rather than paying directly from the customer's card or bank account. At checkout, the customers select ""Pay with BKM Express"". They are then redirected to a BKM Express page, there they s",
Quora,https://www.quora.com/How-do-e-wallets-work,E-Wallet Discussion,"A Crypto Wallet is essentially a user interface that interacts with the blockchain via your public and private keys. Some wallets like Coinbase, hold on to your keys, and therefore they are not really in your control. So the risk is up to you. Other wallets like Jaxx, allow for your to export your private keys, which you might lose. So the risk is up to you. The wallet when sending cryptocurrency will ask your to confirm the transaction and that confirmation triggers a private key signature, which then is published to the blockchain. There may be other functionality a wallet provides, but thats up to the direction they are taking. Hopefully that helps",
Quora,https://www.quora.com/How-do-e-wallets-work,E-Wallet Discussion,"If you tell them a bit about yourself and your vehicle, theyвҖҷll send you personalized quotes so you can compare them and find the best one for you.",
Quora,https://www.quora.com/How-do-e-wallets-work,E-Wallet Discussion,"For any online transaction to be completed, merchants will need to have a payment gateway. If not it is just like saying a customer goes to a retail store and giv",
Quora,https://www.quora.com/How-do-e-wallets-work,E-Wallet Discussion,How does a Bitcoin wallet work?,
Quora,https://www.quora.com/How-do-e-wallets-work,E-Wallet Discussion,"Related
How do digital wallets work online?",
Quora,https://www.quora.com/How-do-e-wallets-work,E-Wallet Discussion,Pay contactless with QR code payments in different outlets.,
